"No.","Time","Source","Destination","Protocol","Length","Antenna signal","Data rate (Mb/s)","SSID","Signal strength (dBm)","Type/Subtype","Info"
"217","4.544628027","192.168.33.211","17.253.18.198","TCP","150","-39 dBm,-40 dBm,-39 dBm","144.444","","-39 dBm","QoS Data","58844  >  80 [FIN, ACK] Seq=1 Ack=1 Win=2053 Len=0 TSval=1957993827 TSecr=3314241134"
"271","8.440415499","2402:3a80:1bd5:d964:c9a3:a1a8:4554:7741","2402:3a80:1bd5:d964::57","ICMPv6","293","-38 dBm,-43 dBm,-38 dBm","144.444","","-38 dBm","QoS Data","Destination Unreachable (Port unreachable)"
"275","8.441314751","2402:3a80:1bd5:d964:c9a3:a1a8:4554:7741","2404:6800:4002:815::200e","QUIC","1376","-38 dBm,-43 dBm,-38 dBm","144.444","","-38 dBm","QoS Data","Initial, DCID=18bbd547c6951034, PKN: 1, CRYPTO"
"276","8.441320063","2402:3a80:1bd5:d964:c9a3:a1a8:4554:7741","2404:6800:4002:815::200e","QUIC","1376","-38 dBm,-43 dBm,-38 dBm","144.444","","-38 dBm","QoS Data","Initial, DCID=18bbd547c6951034, PKN: 2, CRYPTO, CRYPTO, PING, PADDING, CRYPTO, PADDING, CRYPTO, PADDING, CRYPTO, PING, CRYPTO, CRYPTO, CRYPTO, CRYPTO, PADDING, PING, PADDING, CRYPTO, CRYPTO"
"280","8.442568633","2402:3a80:1bd5:d964:c9a3:a1a8:4554:7741","2404:6800:4002:815::200e","TCP","182","-38 dBm,-43 dBm,-38 dBm","144.444","","-38 dBm","QoS Data","58881  >  443 [SYN] Seq=0 Win=65535 Len=0 MSS=1298 WS=64 TSval=1674000220 TSecr=0 SACK_PERM"
"281","8.442755348","2402:3a80:1bd5:d964:c9a3:a1a8:4554:7741","2606:4700::6811:180e","QUIC","1376","-38 dBm,-43 dBm,-38 dBm","144.444","","-38 dBm","QoS Data","Initial, DCID=cf0737ed66c37faa, PKN: 1, CRYPTO"
"282","8.442764885","2402:3a80:1bd5:d964:c9a3:a1a8:4554:7741","2606:4700::6811:180e","QUIC","1376","-38 dBm,-43 dBm,-38 dBm","144.444","","-38 dBm","QoS Data","Initial, DCID=cf0737ed66c37faa, PKN: 2, PING, CRYPTO, PADDING, PING, PING, PING, PADDING, CRYPTO, PADDING, CRYPTO, PADDING, PING, PADDING, CRYPTO, PING, PADDING, CRYPTO, PING, PING, CRYPTO, CRYPTO, PING"
"283","8.442767887","2402:3a80:1bd5:d964:c9a3:a1a8:4554:7741","2606:4700:4400::6812:2844","TCP","182","-38 dBm,-43 dBm,-38 dBm","144.444","","-38 dBm","QoS Data","58882  >  443 [SYN] Seq=0 Win=65535 Len=0 MSS=1298 WS=64 TSval=2145343006 TSecr=0 SACK_PERM"
"284","8.442773178","2402:3a80:1bd5:d964:c9a3:a1a8:4554:7741","2402:3a80:1bd5:d964::57","DNS","184","-38 dBm,-43 dBm,-38 dBm","144.444","","-38 dBm","QoS Data","Standard query 0xf571 AAAA connect.facebook.net"
"285","8.442776445","2402:3a80:1bd5:d964:c9a3:a1a8:4554:7741","2402:3a80:1bd5:d964::57","DNS","184","-38 dBm,-43 dBm,-38 dBm","144.444","","-38 dBm","QoS Data","Standard query 0xf3df A connect.facebook.net"
"286","8.442779781","2402:3a80:1bd5:d964:c9a3:a1a8:4554:7741","2402:3a80:1bd5:d964::57","DNS","184","-38 dBm,-43 dBm,-38 dBm","144.444","","-38 dBm","QoS Data","Standard query 0x432a HTTPS connect.facebook.net"
"290","8.449823219","2404:6800:4002:825::200e","2402:3a80:1bd5:d964:c9a3:a1a8:4554:7741","TCP","178","-27 dBm,-33 dBm,-27 dBm","117","","-27 dBm","QoS Data","443  >  58880 [SYN, ACK] Seq=0 Ack=1 Win=65535 Len=0 MSS=1360 SACK_PERM TSval=2495363268 TSecr=3482142038 WS=256"
"297","8.453486659","2402:3a80:1bd5:d964:c9a3:a1a8:4554:7741","2404:6800:4002:825::200e","TCP","170","-38 dBm,-43 dBm,-38 dBm","144.444","","-38 dBm","QoS Data","58880  >  443 [ACK] Seq=1 Ack=1 Win=2049 Len=0 TSval=3482142084 TSecr=2495363268"
"301","8.453861355","2402:3a80:1bd5:d964:c9a3:a1a8:4554:7741","2404:6800:4002:825::200e","TCP","1456","-38 dBm,-43 dBm,-38 dBm","144.444","","-38 dBm","QoS Data","58880  >  443 [ACK] Seq=1 Ack=1 Win=2049 Len=1286 TSval=3482142084 TSecr=2495363268 [TCP PDU reassembled in 302]"
"302","8.453871867","2402:3a80:1bd5:d964:c9a3:a1a8:4554:7741","2404:6800:4002:825::200e","TLSv1.3","1128","-38 dBm,-43 dBm,-38 dBm","144.444","","-38 dBm","QoS Data","Client Hello (SNI=www.youtube.com)"
"320","8.483961192","2a03:2880:f144:82:face:b00c:0:25de","2402:3a80:1bd5:d964:c9a3:a1a8:4554:7741","QUIC","1378","-27 dBm,-34 dBm,-27 dBm","117","","-27 dBm","QoS Data","Initial, SCID=b021010b1c1f6ce0"
"321","8.483969750","2a03:2880:f144:82:face:b00c:0:25de","2402:3a80:1bd5:d964:c9a3:a1a8:4554:7741","QUIC","432","-27 dBm,-34 dBm,-27 dBm","117","","-27 dBm","QoS Data","Handshake, SCID=b021010b1c1f6ce0"
"322","8.483974086","2a03:2880:f144:82:face:b00c:0:25de","2402:3a80:1bd5:d964:c9a3:a1a8:4554:7741","QUIC","194","-27 dBm,-34 dBm,-27 dBm","117","","-27 dBm","QoS Data","Protected Payload (KP0)"
"324","8.483982893","2a03:2880:f144:82:face:b00c:0:25de","2402:3a80:1bd5:d964:c9a3:a1a8:4554:7741","QUIC","226","-28 dBm,-34 dBm,-28 dBm","117","","-28 dBm","QoS Data","Protected Payload (KP0)"
"326","8.486663586","2a03:2880:f144:82:face:b00c:0:25de","2402:3a80:1bd5:d964:c9a3:a1a8:4554:7741","QUIC","194","-27 dBm,-34 dBm,-27 dBm","117","","-27 dBm","QoS Data","Protected Payload (KP0)"
"328","8.486696981","2a03:2880:f144:82:face:b00c:0:25de","2402:3a80:1bd5:d964:c9a3:a1a8:4554:7741","QUIC","194","-28 dBm,-34 dBm,-28 dBm","117","","-28 dBm","QoS Data","Protected Payload (KP0)"
"331","8.489048945","2a03:2880:f144:82:face:b00c:0:25de","2402:3a80:1bd5:d964:c9a3:a1a8:4554:7741","QUIC","418","-28 dBm,-33 dBm,-28 dBm","117","","-28 dBm","QoS Data","Protected Payload (KP0)"
"333","8.489082640","2a03:2880:f144:82:face:b00c:0:25de","2402:3a80:1bd5:d964:c9a3:a1a8:4554:7741","QUIC","194","-27 dBm,-33 dBm,-27 dBm","117","","-27 dBm","QoS Data","Protected Payload (KP0)"
"337","8.489100203","2402:3a80:1bd5:d964:c9a3:a1a8:4554:7741","2a03:2880:f144:82:face:b00c:0:25de","QUIC","227","-38 dBm,-43 dBm,-38 dBm","144.444","","-38 dBm","QoS Data","Handshake, DCID=b021010b1c1f6ce0"
"338","8.489104507","2402:3a80:1bd5:d964:c9a3:a1a8:4554:7741","2a03:2880:f144:82:face:b00c:0:25de","QUIC","180","-38 dBm,-43 dBm,-38 dBm","144.444","","-38 dBm","QoS Data","Protected Payload (KP0), DCID=b021010b1c1f6ce0"
"342","8.491183090","2402:3a80:1bd5:d964:c9a3:a1a8:4554:7741","2a03:2880:f144:82:face:b00c:0:25de","QUIC","184","-38 dBm,-43 dBm,-38 dBm","144.444","","-38 dBm","QoS Data","Protected Payload (KP0), DCID=b021010b1c1f6ce0"
"348","8.514646067","103.25.231.30","192.168.33.211","TCP","158","-28 dBm,-33 dBm,-28 dBm","117","","-28 dBm","QoS Data","443  >  58879 [SYN, ACK] Seq=0 Ack=1 Win=28960 Len=0 MSS=1318 SACK_PERM TSval=898417471 TSecr=2942635026 WS=128"
"352","8.514693824","2402:3a80:1bd5:d964:c9a3:a1a8:4554:7741","2606:4700::6811:180e","QUIC","1376","-38 dBm,-43 dBm,-38 dBm","144.444","","-38 dBm","QoS Data","Initial, DCID=cf0737ed66c37faa, PKN: 4, CRYPTO"
"354","8.515210974","2404:6800:4002:81b::200a","2402:3a80:1bd5:d964:c9a3:a1a8:4554:7741","QUIC","1376","-27 dBm,-33 dBm,-27 dBm","117","","-27 dBm","QoS Data","Initial, SCID=ece984a730c28393"
"356","8.515249427","2404:6800:4002:81b::200a","2402:3a80:1bd5:d964:c9a3:a1a8:4554:7741","QUIC","1376","-27 dBm,-33 dBm,-27 dBm","117","","-27 dBm","QoS Data","Initial, SCID=ece984a730c28393"
"360","8.515488553","2402:3a80:1bd5:d964:c9a3:a1a8:4554:7741","2a03:2880:f144:82:face:b00c:0:25de","QUIC","181","-38 dBm,-43 dBm,-38 dBm","144.444","","-38 dBm","QoS Data","Protected Payload (KP0), DCID=b021010b1c1f6ce0"
"362","8.515735138","103.25.231.30","192.168.33.211","TCP","158","-27 dBm,-34 dBm,-27 dBm","117","","-27 dBm","QoS Data","443  >  58878 [SYN, ACK] Seq=0 Ack=1 Win=28960 Len=0 MSS=1318 SACK_PERM TSval=898417477 TSecr=2528937132 WS=128"
"366","8.515928474","192.168.33.211","103.25.231.30","TCP","150","-38 dBm,-43 dBm,-38 dBm","144.444","","-38 dBm","QoS Data","58879  >  443 [ACK] Seq=1 Ack=1 Win=2061 Len=0 TSval=2942635188 TSecr=898417471"
"368","8.517332227","2402:3a80:1bd5:d964::57","2402:3a80:1bd5:d964:c9a3:a1a8:4554:7741","DNS","216","-28 dBm,-33 dBm,-28 dBm","117","","-28 dBm","QoS Data","Standard query response 0x5eef AAAA www.google-analytics.com AAAA 2404:6800:4002:823::200e"
"372","8.517382337","192.168.33.211","103.25.231.30","TCP","1456","-38 dBm,-43 dBm,-38 dBm","144.444","","-38 dBm","QoS Data","58879  >  443 [ACK] Seq=1 Ack=1 Win=2061 Len=1306 TSval=2942635188 TSecr=898417471 [TCP PDU reassembled in 373]"
"373","8.517390242","192.168.33.211","103.25.231.30","TLSv1.2","869","-38 dBm,-43 dBm,-38 dBm","144.444","","-38 dBm","QoS Data","Client Hello (SNI=iiitd.ac.in)"
"374","8.517394670","192.168.33.211","103.25.231.30","TCP","150","-38 dBm,-43 dBm,-38 dBm","144.444","","-38 dBm","QoS Data","58878  >  443 [ACK] Seq=1 Ack=1 Win=2061 Len=0 TSval=2528937309 TSecr=898417477"
"376","8.517405253","2402:3a80:1bd5:d964::57","2402:3a80:1bd5:d964:c9a3:a1a8:4554:7741","DNS","204","-28 dBm,-33 dBm,-28 dBm","117","","-28 dBm","QoS Data","Standard query response 0x8b12 A www.google-analytics.com A 142.250.193.46"
"378","8.517462742","2402:3a80:1bd5:d964::57","2402:3a80:1bd5:d964:c9a3:a1a8:4554:7741","DNS","267","-27 dBm,-33 dBm,-27 dBm","117","","-27 dBm","QoS Data","Standard query response 0x984c HTTPS www.google-analytics.com CNAME www-alv.google-analytics.com SOA ns1.google.com"
"382","8.518823969","192.168.33.211","103.25.231.30","TCP","1456","-38 dBm,-43 dBm,-38 dBm","144.444","","-38 dBm","QoS Data","58878  >  443 [ACK] Seq=1 Ack=1 Win=2061 Len=1306 TSval=2528937309 TSecr=898417477 [TCP PDU reassembled in 383]"
"383","8.518838385","192.168.33.211","103.25.231.30","TLSv1.2","869","-38 dBm,-43 dBm,-38 dBm","144.444","","-38 dBm","QoS Data","Client Hello (SNI=iiitd.ac.in)"
"389","8.524655647","2404:6800:4002:825::200e","2402:3a80:1bd5:d964:c9a3:a1a8:4554:7741","TCP","170","-27 dBm,-34 dBm,-27 dBm","117","","-27 dBm","QoS Data","443  >  58880 [ACK] Seq=1 Ack=1287 Win=68608 Len=0 TSval=2495363345 TSecr=3482142084"
"392","8.526510211","2404:6800:4002:825::200e","2402:3a80:1bd5:d964:c9a3:a1a8:4554:7741","TCP","170","-27 dBm,-33 dBm,-27 dBm","117","","-27 dBm","QoS Data","443  >  58880 [ACK] Seq=1 Ack=2245 Win=71168 Len=0 TSval=2495363346 TSecr=3482142084"
"394","8.527225926","2402:3a80:1bd5:d964::57","2402:3a80:1bd5:d964:c9a3:a1a8:4554:7741","DNS","244","-27 dBm,-34 dBm,-27 dBm","117","","-27 dBm","QoS Data","Standard query response 0xf571 AAAA connect.facebook.net CNAME scontent.xx.fbcdn.net AAAA 2a03:2880:f044:10:face:b00c:0:3"
"396","8.527450622","2402:3a80:1bd5:d964::57","2402:3a80:1bd5:d964:c9a3:a1a8:4554:7741","DNS","232","-27 dBm,-33 dBm,-27 dBm","117","","-27 dBm","QoS Data","Standard query response 0xf3df A connect.facebook.net CNAME scontent.xx.fbcdn.net A 157.240.198.15"
"398","8.528000962","2402:3a80:1bd5:d964::57","2402:3a80:1bd5:d964:c9a3:a1a8:4554:7741","DNS","297","-27 dBm,-33 dBm,-27 dBm","117","","-27 dBm","QoS Data","Standard query response 0x432a HTTPS connect.facebook.net CNAME scontent.xx.fbcdn.net HTTPS HTTPS"
"400","8.529449052","2a03:2880:f144:82:face:b00c:0:25de","2402:3a80:1bd5:d964:c9a3:a1a8:4554:7741","QUIC","185","-27 dBm,-33 dBm,-27 dBm","117","","-27 dBm","QoS Data","Handshake, SCID=b021010b1c1f6ce0"
"402","8.529551182","2a03:2880:f144:82:face:b00c:0:25de","2402:3a80:1bd5:d964:c9a3:a1a8:4554:7741","QUIC","258","-27 dBm,-33 dBm,-27 dBm","117","","-27 dBm","QoS Data","Protected Payload (KP0)"
"404","8.529687612","2a03:2880:f144:82:face:b00c:0:25de","2402:3a80:1bd5:d964:c9a3:a1a8:4554:7741","QUIC","418","-27 dBm,-33 dBm,-27 dBm","117","","-27 dBm","QoS Data","Protected Payload (KP0)"
"409","8.533036218","2402:3a80:1bd5:d964:c9a3:a1a8:4554:7741","2a03:2880:f144:82:face:b00c:0:25de","QUIC","180","-38 dBm,-43 dBm,-38 dBm","144.444","","-38 dBm","QoS Data","Protected Payload (KP0), DCID=b021010b1c1f6ce0"
"423","8.549107301","2402:3a80:1bd5:d964:c9a3:a1a8:4554:7741","2404:6800:4002:81b::200a","QUIC","1376","-38 dBm,-43 dBm,-38 dBm","144.444","","-38 dBm","QoS Data","Initial, DCID=ece984a730c28393"
"426","8.553737174","2606:4700::6811:180e","2402:3a80:1bd5:d964:c9a3:a1a8:4554:7741","QUIC","1346","-28 dBm,-33 dBm,-28 dBm","117","","-28 dBm","QoS Data","Initial, SCID=01472080f7e5a5613b45858081e5b386dec8c6f5, PKN: 0, ACK"
"428","8.553801269","2a03:2880:f144:82:face:b00c:0:25de","2402:3a80:1bd5:d964:c9a3:a1a8:4554:7741","QUIC","194","-27 dBm,-33 dBm,-27 dBm","117","","-27 dBm","QoS Data","Protected Payload (KP0)"
"434","8.557945847","2606:4700::6811:180e","2402:3a80:1bd5:d964:c9a3:a1a8:4554:7741","QUIC","1346","-28 dBm,-33 dBm,-28 dBm","117","","-28 dBm","QoS Data","Initial, SCID=01472080f7e5a5613b45858081e5b386dec8c6f5, PKN: 1, ACK, CRYPTO"
"435","8.557950430","2606:4700::6811:180e","2402:3a80:1bd5:d964:c9a3:a1a8:4554:7741","QUIC","1346","-28 dBm,-33 dBm,-28 dBm","117","","-28 dBm","QoS Data","Initial, SCID=01472080f7e5a5613b45858081e5b386dec8c6f5, PKN: 2, CRYPTO"
"436","8.557953379","2606:4700::6811:180e","2402:3a80:1bd5:d964:c9a3:a1a8:4554:7741","QUIC","1346","-28 dBm,-33 dBm,-28 dBm","117","","-28 dBm","QoS Data","Handshake, SCID=01472080f7e5a5613b45858081e5b386dec8c6f5"
"438","8.558257675","2606:4700::6811:180e","2402:3a80:1bd5:d964:c9a3:a1a8:4554:7741","QUIC","1176","-27 dBm,-33 dBm,-27 dBm","117","","-27 dBm","QoS Data","Handshake, SCID=01472080f7e5a5613b45858081e5b386dec8c6f5"
"440","8.559574222","2606:4700:4400::6812:2844","2402:3a80:1bd5:d964:c9a3:a1a8:4554:7741","TCP","178","-28 dBm,-33 dBm,-28 dBm","117","","-28 dBm","QoS Data","443  >  58882 [SYN, ACK] Seq=0 Ack=1 Win=65535 Len=0 MSS=1360 SACK_PERM TSval=236386224 TSecr=2145343006 WS=8192"
"447","8.563068809","2402:3a80:1bd5:d964:c9a3:a1a8:4554:7741","2606:4700::6811:180e","QUIC","1376","-38 dBm,-43 dBm,-38 dBm","144.444","","-38 dBm","QoS Data","Initial, DCID=01472080f7e5a5613b45858081e5b386dec8c6f5, PKN: 5, ACK, PADDING"
"448","8.563072818","2402:3a80:1bd5:d964:c9a3:a1a8:4554:7741","2606:4700::6811:180e","QUIC","197","-38 dBm,-43 dBm,-38 dBm","144.444","","-38 dBm","QoS Data","Handshake, DCID=01472080f7e5a5613b45858081e5b386dec8c6f5"
"449","8.563076375","2402:3a80:1bd5:d964:c9a3:a1a8:4554:7741","2606:4700:4400::6812:2844","TCP","170","-38 dBm,-43 dBm,-38 dBm","144.444","","-38 dBm","QoS Data","58882  >  443 [ACK] Seq=1 Ack=1 Win=131136 Len=0 TSval=2145343127 TSecr=236386224"
"451","8.563311239","2402:3a80:1bd5:d964:c9a3:a1a8:4554:7741","2606:4700:4400::6812:2844","TCP","1456","-38 dBm,-43 dBm,-38 dBm","144.444","","-38 dBm","QoS Data","58882  >  443 [ACK] Seq=1 Ack=1 Win=131136 Len=1286 TSval=2145343127 TSecr=236386224 [TCP PDU reassembled in 452]"
"452","8.563314987","2402:3a80:1bd5:d964:c9a3:a1a8:4554:7741","2606:4700:4400::6812:2844","TLSv1.2","884","-38 dBm,-43 dBm,-38 dBm","144.444","","-38 dBm","QoS Data","Client Hello (SNI=pro.fontawesome.com)"
"456","8.565285170","2402:3a80:1bd5:d964:c9a3:a1a8:4554:7741","2606:4700::6811:180e","QUIC","231","-38 dBm,-43 dBm,-38 dBm","144.444","","-38 dBm","QoS Data","Handshake, DCID=01472080f7e5a5613b45858081e5b386dec8c6f5"
"457","8.565289195","2402:3a80:1bd5:d964:c9a3:a1a8:4554:7741","2606:4700::6811:180e","QUIC","229","-38 dBm,-43 dBm,-38 dBm","144.444","","-38 dBm","QoS Data","Protected Payload (KP0), DCID=01472080f7e5a5613b45858081e5b386dec8c6f5"
"465","8.578066504","2404:6800:4002:81b::200a","2402:3a80:1bd5:d964:c9a3:a1a8:4554:7741","QUIC","1376","-27 dBm,-33 dBm,-27 dBm","117","","-27 dBm","QoS Data","Initial, SCID=ece984a730c28393"
"466","8.578071456","2404:6800:4002:81b::200a","2402:3a80:1bd5:d964:c9a3:a1a8:4554:7741","QUIC","446","-27 dBm,-33 dBm,-27 dBm","117","","-27 dBm","QoS Data","Protected Payload (KP0)"
"467","8.578074843","2404:6800:4002:81b::200a","2402:3a80:1bd5:d964:c9a3:a1a8:4554:7741","QUIC","1076","-27 dBm,-33 dBm,-27 dBm","117","","-27 dBm","QoS Data","Protected Payload (KP0)"
"468","8.578078356","2404:6800:4002:81b::200a","2402:3a80:1bd5:d964:c9a3:a1a8:4554:7741","QUIC","223","-27 dBm,-33 dBm,-27 dBm","117","","-27 dBm","QoS Data","Protected Payload (KP0)"
"470","8.578249042","2404:6800:4002:81b::200a","2402:3a80:1bd5:d964:c9a3:a1a8:4554:7741","QUIC","1076","-27 dBm,-33 dBm,-27 dBm","117","","-27 dBm","QoS Data","Protected Payload (KP0)"
"471","8.578252317","2404:6800:4002:81b::200a","2402:3a80:1bd5:d964:c9a3:a1a8:4554:7741","QUIC","223","-27 dBm,-33 dBm,-27 dBm","117","","-27 dBm","QoS Data","Protected Payload (KP0)"
"473","8.578517922","2404:6800:4002:81b::200a","2402:3a80:1bd5:d964:c9a3:a1a8:4554:7741","QUIC","1076","-26 dBm,-32 dBm,-26 dBm","78","","-26 dBm","QoS Data","Protected Payload (KP0)"
"475","8.578756626","2404:6800:4002:81b::200a","2402:3a80:1bd5:d964:c9a3:a1a8:4554:7741","QUIC","170","-27 dBm,-34 dBm,-27 dBm","117","","-27 dBm","QoS Data","Protected Payload (KP0)"
"479","8.582034729","2402:3a80:1bd5:d964:c9a3:a1a8:4554:7741","2404:6800:4002:81b::200a","QUIC","224","-38 dBm,-43 dBm,-38 dBm","144.444","","-38 dBm","QoS Data","Handshake, DCID=ece984a730c28393"
"480","8.582038919","2402:3a80:1bd5:d964:c9a3:a1a8:4554:7741","2404:6800:4002:81b::200a","QUIC","177","-38 dBm,-43 dBm,-38 dBm","144.444","","-38 dBm","QoS Data","Protected Payload (KP0), DCID=ece984a730c28393"
"481","8.582042246","2402:3a80:1bd5:d964:c9a3:a1a8:4554:7741","2404:6800:4002:81b::200a","QUIC","661","-38 dBm,-43 dBm,-38 dBm","144.444","","-38 dBm","QoS Data","Protected Payload (KP0), DCID=ece984a730c28393"
"487","8.595543509","2404:6800:4002:825::200e","2402:3a80:1bd5:d964:c9a3:a1a8:4554:7741","TCP","1378","-28 dBm,-33 dBm,-28 dBm","117","","-28 dBm","QoS Data","443  >  58880 [ACK] Seq=1 Ack=2245 Win=71168 Len=1208 TSval=2495363414 TSecr=3482142084 [TCP PDU reassembled in 489]"
"489","8.595626833","2404:6800:4002:825::200e","2402:3a80:1bd5:d964:c9a3:a1a8:4554:7741","TLSv1.3","426","-27 dBm,-34 dBm,-27 dBm","117","","-27 dBm","QoS Data","Server Hello, Change Cipher Spec, Application Data"
"494","8.598386279","2402:3a80:1bd5:d964:c9a3:a1a8:4554:7741","2404:6800:4002:825::200e","TCP","170","-38 dBm,-43 dBm,-38 dBm","144.444","","-38 dBm","QoS Data","58880  >  443 [ACK] Seq=2245 Ack=1465 Win=2026 Len=0 TSval=3482142230 TSecr=2495363414"
"499","8.599071766","2402:3a80:1bd5:d964:c9a3:a1a8:4554:7741","2404:6800:4002:825::200e","TLSv1.3","244","-38 dBm,-43 dBm,-38 dBm","144.444","","-38 dBm","QoS Data","Change Cipher Spec, Application Data"
"500","8.599076396","2402:3a80:1bd5:d964:c9a3:a1a8:4554:7741","2404:6800:4002:825::200e","TLSv1.3","262","-38 dBm,-43 dBm,-38 dBm","144.444","","-38 dBm","QoS Data","Application Data"
"502","8.600616639","2404:6800:4002:81b::200a","2402:3a80:1bd5:d964:c9a3:a1a8:4554:7741","QUIC","1376","-27 dBm,-34 dBm,-27 dBm","117","","-27 dBm","QoS Data","Initial, SCID=ece984a730c28393"
"503","8.600989909","2404:6800:4002:81b::200a","2402:3a80:1bd5:d964:c9a3:a1a8:4554:7741","QUIC","1376","-27 dBm,-32 dBm,-27 dBm","78","","-27 dBm","QoS Data","Initial, SCID=ece984a730c28393"
"507","8.605468249","2402:3a80:1bd5:d964:c9a3:a1a8:4554:7741","2404:6800:4002:825::200e","TCP","1456","-38 dBm,-43 dBm,-38 dBm","144.444","","-38 dBm","QoS Data","58880  >  443 [ACK] Seq=2411 Ack=1465 Win=2048 Len=1286 TSval=3482142231 TSecr=2495363414 [TCP PDU reassembled in 508]"
"508","8.605476060","2402:3a80:1bd5:d964:c9a3:a1a8:4554:7741","2404:6800:4002:825::200e","TLSv1.3","717","-38 dBm,-43 dBm,-38 dBm","144.444","","-38 dBm","QoS Data","Application Data"
"509","8.605478930","2402:3a80:1bd5:d964:c9a3:a1a8:4554:7741","2404:6800:4002:825::200e","TCP","1456","-38 dBm,-43 dBm,-38 dBm","144.444","","-38 dBm","QoS Data","58880  >  443 [ACK] Seq=4244 Ack=1465 Win=2048 Len=1286 TSval=3482142231 TSecr=2495363414 [TCP PDU reassembled in 510]"
"510","8.605481690","2402:3a80:1bd5:d964:c9a3:a1a8:4554:7741","2404:6800:4002:825::200e","TLSv1.3","316","-38 dBm,-43 dBm,-38 dBm","144.444","","-38 dBm","QoS Data","Application Data"
"521","8.634655411","2a03:2880:f144:82:face:b00c:0:25de","2402:3a80:1bd5:d964:c9a3:a1a8:4554:7741","QUIC","169","-28 dBm,-34 dBm,-28 dBm","117","","-28 dBm","QoS Data","Protected Payload (KP0)"
"522","8.634660395","2a03:2880:f144:82:face:b00c:0:25de","2402:3a80:1bd5:d964:c9a3:a1a8:4554:7741","QUIC","169","-28 dBm,-34 dBm,-28 dBm","117","","-28 dBm","QoS Data","Protected Payload (KP0)"
"523","8.634678537","2404:6800:4002:81b::200a","2402:3a80:1bd5:d964:c9a3:a1a8:4554:7741","QUIC","266","-28 dBm,-34 dBm,-28 dBm","117","","-28 dBm","QoS Data","Protected Payload (KP0)"
"529","8.639835670","2402:3a80:1bd5:d964:c9a3:a1a8:4554:7741","2a03:2880:f144:82:face:b00c:0:25de","QUIC","182","-38 dBm,-43 dBm,-38 dBm","144.444","","-38 dBm","QoS Data","Protected Payload (KP0), DCID=b021010b1c1f6ce0"
"530","8.639847179","2402:3a80:1bd5:d964:c9a3:a1a8:4554:7741","2a03:2880:f144:82:face:b00c:0:25de","QUIC","182","-38 dBm,-43 dBm,-38 dBm","144.444","","-38 dBm","QoS Data","Protected Payload (KP0), DCID=b021010b1c1f6ce0"
"531","8.639850913","2402:3a80:1bd5:d964:c9a3:a1a8:4554:7741","2404:6800:4002:81b::200a","QUIC","180","-38 dBm,-43 dBm,-38 dBm","144.444","","-38 dBm","QoS Data","Protected Payload (KP0), DCID=ece984a730c28393"
"535","8.640185769","2404:6800:4002:81b::200a","2402:3a80:1bd5:d964:c9a3:a1a8:4554:7741","QUIC","175","-28 dBm,-34 dBm,-28 dBm","117","","-28 dBm","QoS Data","Protected Payload (KP0)"
"536","8.640197047","2404:6800:4002:825::200e","2402:3a80:1bd5:d964:c9a3:a1a8:4554:7741","TCP","170","-28 dBm,-34 dBm,-28 dBm","117","","-28 dBm","QoS Data","443  >  58880 [ACK] Seq=1465 Ack=2319 Win=71168 Len=0 TSval=2495363460 TSecr=3482142230"
"537","8.640201849","2404:6800:4002:825::200e","2402:3a80:1bd5:d964:c9a3:a1a8:4554:7741","TCP","170","-28 dBm,-34 dBm,-28 dBm","117","","-28 dBm","QoS Data","443  >  58880 [ACK] Seq=1465 Ack=2411 Win=71168 Len=0 TSval=2495363460 TSecr=3482142231"
"540","8.640659432","2404:6800:4002:81b::200a","2402:3a80:1bd5:d964:c9a3:a1a8:4554:7741","QUIC","175","-26 dBm,-32 dBm,-26 dBm","78","","-26 dBm","QoS Data","Protected Payload (KP0)"
"541","8.640663843","2404:6800:4002:825::200e","2402:3a80:1bd5:d964:c9a3:a1a8:4554:7741","TCP","170","-26 dBm,-32 dBm,-26 dBm","78","","-26 dBm","QoS Data","443  >  58880 [ACK] Seq=1465 Ack=2319 Win=71168 Len=0 TSval=2495363460 TSecr=3482142230"
"542","8.640673669","2404:6800:4002:825::200e","2402:3a80:1bd5:d964:c9a3:a1a8:4554:7741","TCP","170","-26 dBm,-32 dBm,-26 dBm","78","","-26 dBm","QoS Data","443  >  58880 [ACK] Seq=1465 Ack=2411 Win=71168 Len=0 TSval=2495363460 TSecr=3482142231"
"546","8.641795904","2404:6800:4002:81b::200a","2402:3a80:1bd5:d964:c9a3:a1a8:4554:7741","QUIC","175","-26 dBm,-32 dBm,-26 dBm","52","","-26 dBm","QoS Data","Protected Payload (KP0)"
"547","8.641799983","2404:6800:4002:825::200e","2402:3a80:1bd5:d964:c9a3:a1a8:4554:7741","TCP","170","-26 dBm,-32 dBm,-26 dBm","52","","-26 dBm","QoS Data","443  >  58880 [ACK] Seq=1465 Ack=2319 Win=71168 Len=0 TSval=2495363460 TSecr=3482142230"
"548","8.641803189","2404:6800:4002:825::200e","2402:3a80:1bd5:d964:c9a3:a1a8:4554:7741","TCP","170","-26 dBm,-32 dBm,-26 dBm","52","","-26 dBm","QoS Data","443  >  58880 [ACK] Seq=1465 Ack=2411 Win=71168 Len=0 TSval=2495363460 TSecr=3482142231"
"549","8.641807908","2404:6800:4002:825::200e","2402:3a80:1bd5:d964:c9a3:a1a8:4554:7741","TLSv1.3","1130","-26 dBm,-32 dBm,-26 dBm","52","","-26 dBm","QoS Data","Application Data, Application Data"
"550","8.641812611","2404:6800:4002:825::200e","2402:3a80:1bd5:d964:c9a3:a1a8:4554:7741","TLSv1.3","201","-26 dBm,-32 dBm,-26 dBm","52","","-26 dBm","QoS Data","Application Data"
"553","8.642386265","2404:6800:4002:81b::200a","2402:3a80:1bd5:d964:c9a3:a1a8:4554:7741","QUIC","175","-25 dBm,-31 dBm,-25 dBm","39","","-25 dBm","QoS Data","Protected Payload (KP0)"
"554","8.642389959","2404:6800:4002:825::200e","2402:3a80:1bd5:d964:c9a3:a1a8:4554:7741","TCP","170","-25 dBm,-31 dBm,-25 dBm","39","","-25 dBm","QoS Data","443  >  58880 [ACK] Seq=1465 Ack=2319 Win=71168 Len=0 TSval=2495363460 TSecr=3482142230"
"555","8.642393130","2404:6800:4002:825::200e","2402:3a80:1bd5:d964:c9a3:a1a8:4554:7741","TCP","170","-25 dBm,-31 dBm,-25 dBm","39","","-25 dBm","QoS Data","443  >  58880 [ACK] Seq=1465 Ack=2411 Win=71168 Len=0 TSval=2495363460 TSecr=3482142231"
"556","8.642397089","2404:6800:4002:825::200e","2402:3a80:1bd5:d964:c9a3:a1a8:4554:7741","TCP","1130","-25 dBm,-31 dBm,-25 dBm","39","","-25 dBm","QoS Data","[TCP Retransmission] 443  >  58880 [PSH, ACK] Seq=1465 Ack=2411 Win=71168 Len=960 TSval=2495363461 TSecr=3482142231"
"557","8.642401987","2404:6800:4002:825::200e","2402:3a80:1bd5:d964:c9a3:a1a8:4554:7741","TCP","201","-25 dBm,-31 dBm,-25 dBm","39","","-25 dBm","QoS Data","[TCP Retransmission] 443  >  58880 [PSH, ACK] Seq=2425 Ack=2411 Win=71168 Len=31 TSval=2495363461 TSecr=3482142231"
"560","8.643172720","2404:6800:4002:81b::200a","2402:3a80:1bd5:d964:c9a3:a1a8:4554:7741","QUIC","175","-25 dBm,-31 dBm,-25 dBm","26","","-25 dBm","QoS Data","Protected Payload (KP0)"
"561","8.643178686","2404:6800:4002:825::200e","2402:3a80:1bd5:d964:c9a3:a1a8:4554:7741","TCP","170","-25 dBm,-31 dBm,-25 dBm","26","","-25 dBm","QoS Data","443  >  58880 [ACK] Seq=1465 Ack=2319 Win=71168 Len=0 TSval=2495363460 TSecr=3482142230"
"562","8.643182169","2404:6800:4002:825::200e","2402:3a80:1bd5:d964:c9a3:a1a8:4554:7741","TCP","170","-25 dBm,-31 dBm,-25 dBm","26","","-25 dBm","QoS Data","443  >  58880 [ACK] Seq=1465 Ack=2411 Win=71168 Len=0 TSval=2495363460 TSecr=3482142231"
"563","8.643185874","2404:6800:4002:825::200e","2402:3a80:1bd5:d964:c9a3:a1a8:4554:7741","TCP","1130","-25 dBm,-31 dBm,-25 dBm","26","","-25 dBm","QoS Data","[TCP Retransmission] 443  >  58880 [PSH, ACK] Seq=1465 Ack=2411 Win=71168 Len=960 TSval=2495363461 TSecr=3482142231"
"564","8.643192544","2404:6800:4002:825::200e","2402:3a80:1bd5:d964:c9a3:a1a8:4554:7741","TCP","201","-25 dBm,-31 dBm,-25 dBm","26","","-25 dBm","QoS Data","[TCP Retransmission] 443  >  58880 [PSH, ACK] Seq=2425 Ack=2411 Win=71168 Len=31 TSval=2495363461 TSecr=3482142231"
"569","8.645404695","2402:3a80:1bd5:d964:c9a3:a1a8:4554:7741","2404:6800:4002:825::200e","TCP","170","-38 dBm,-43 dBm,-38 dBm","144.444","","-38 dBm","QoS Data","58880  >  443 [ACK] Seq=5676 Ack=2456 Win=2032 Len=0 TSval=3482142277 TSecr=2495363461"
"573","8.646623476","2402:3a80:1bd5:d964:c9a3:a1a8:4554:7741","2404:6800:4002:81b::200a","QUIC","179","-38 dBm,-43 dBm,-38 dBm","144.444","","-38 dBm","QoS Data","Protected Payload (KP0), DCID=ece984a730c28393"
"574","8.646627651","2402:3a80:1bd5:d964:c9a3:a1a8:4554:7741","2404:6800:4002:825::200e","TLSv1.3","201","-38 dBm,-43 dBm,-38 dBm","144.444","","-38 dBm","QoS Data","Application Data"
"633","12.585274120","103.25.231.30","192.168.33.211","SSL","1456","-28 dBm,-37 dBm,-28 dBm","130","","-28 dBm","QoS Data","[TCP ACKed unseen segment] [TCP Previous segment not captured] , Continuation Data"
"634","12.585299118","103.25.231.30","192.168.33.211","SSL","1456","-28 dBm,-37 dBm,-28 dBm","130","","-28 dBm","QoS Data","Continuation Data"
"635","12.585308503","103.25.231.30","192.168.33.211","SSL","1456","-28 dBm,-37 dBm,-28 dBm","130","","-28 dBm","QoS Data","Continuation Data"
"636","12.585312800","103.25.231.30","192.168.33.211","TCP","1456","-28 dBm,-37 dBm,-28 dBm","130","","-28 dBm","QoS Data","443  >  58879 [ACK] Seq=863541 Ack=4856 Win=42368 Len=1306 TSval=898421541 TSecr=2942639085"
"637","12.585317045","103.25.231.30","192.168.33.211","SSL","1456","-28 dBm,-37 dBm,-28 dBm","130","","-28 dBm","QoS Data","Continuation Data"
"638","12.585320931","103.25.231.30","192.168.33.211","SSL","1456","-28 dBm,-37 dBm,-28 dBm","130","","-28 dBm","QoS Data","Continuation Data"
"639","12.585325364","103.25.231.30","192.168.33.211","SSL","1456","-28 dBm,-37 dBm,-28 dBm","130","","-28 dBm","QoS Data","Continuation Data"
"640","12.585329426","103.25.231.30","192.168.33.211","SSL","1456","-28 dBm,-37 dBm,-28 dBm","130","","-28 dBm","QoS Data","Continuation Data"
"641","12.585334558","103.25.231.30","192.168.33.211","SSL","1456","-28 dBm,-37 dBm,-28 dBm","130","","-28 dBm","QoS Data","Continuation Data"
"642","12.585337414","103.25.231.30","192.168.33.211","SSL","1456","-28 dBm,-37 dBm,-28 dBm","130","","-28 dBm","QoS Data","Continuation Data"
"643","12.585340303","103.25.231.30","192.168.33.211","SSL","1456","-28 dBm,-37 dBm,-28 dBm","130","","-28 dBm","QoS Data","Continuation Data"
"644","12.585343060","103.25.231.30","192.168.33.211","SSL","1456","-28 dBm,-37 dBm,-28 dBm","130","","-28 dBm","QoS Data","Continuation Data"
"645","12.585346778","103.25.231.30","192.168.33.211","SSL","1456","-28 dBm,-37 dBm,-28 dBm","130","","-28 dBm","QoS Data","Continuation Data"
"646","12.585350352","103.25.231.30","192.168.33.211","SSL","1456","-28 dBm,-37 dBm,-28 dBm","130","","-28 dBm","QoS Data","Continuation Data"
"647","12.585354256","103.25.231.30","192.168.33.211","SSL","1456","-28 dBm,-37 dBm,-28 dBm","130","","-28 dBm","QoS Data","Continuation Data"
"648","12.585357505","103.25.231.30","192.168.33.211","SSL","1456","-28 dBm,-37 dBm,-28 dBm","130","","-28 dBm","QoS Data","Continuation Data"
"649","12.585360247","103.25.231.30","192.168.33.211","SSL","1456","-28 dBm,-37 dBm,-28 dBm","130","","-28 dBm","QoS Data","Continuation Data"
"655","12.589623982","192.168.33.211","103.25.231.30","TCP","150","-36 dBm,-43 dBm,-36 dBm","144.444","","-36 dBm","QoS Data","[TCP ACKed unseen segment] [TCP Previous segment not captured] 58879  >  443 [ACK] Seq=4856 Ack=881825 Win=5190 Len=0 TSval=2942639259 TSecr=898421541"
"659","12.625095183","103.25.231.30","192.168.33.211","SSL","1456","-33 dBm,-39 dBm,-33 dBm","19.5","","-33 dBm","QoS Data","Continuation Data"
"660","12.625122047","103.25.231.30","192.168.33.211","SSL","1456","-33 dBm,-39 dBm,-33 dBm","19.5","","-33 dBm","QoS Data","Continuation Data"
"661","12.625126951","103.25.231.30","192.168.33.211","SSL","1456","-33 dBm,-39 dBm,-33 dBm","19.5","","-33 dBm","QoS Data","Continuation Data"
"662","12.625131428","103.25.231.30","192.168.33.211","SSL","1456","-33 dBm,-39 dBm,-33 dBm","19.5","","-33 dBm","QoS Data","Continuation Data"
"663","12.625136198","103.25.231.30","192.168.33.211","SSL","1456","-33 dBm,-39 dBm,-33 dBm","19.5","","-33 dBm","QoS Data","Continuation Data"
"664","12.625140447","103.25.231.30","192.168.33.211","SSL","1456","-33 dBm,-39 dBm,-33 dBm","19.5","","-33 dBm","QoS Data","Continuation Data"
"665","12.625144623","103.25.231.30","192.168.33.211","SSL","1456","-33 dBm,-39 dBm,-33 dBm","19.5","","-33 dBm","QoS Data","Continuation Data"
"666","12.625149629","103.25.231.30","192.168.33.211","SSL","1456","-33 dBm,-39 dBm,-33 dBm","19.5","","-33 dBm","QoS Data","Continuation Data"
"669","12.630625056","192.168.33.211","103.25.231.30","TCP","150","-36 dBm,-43 dBm,-36 dBm","144.444","","-36 dBm","QoS Data","58879  >  443 [ACK] Seq=4856 Ack=885743 Win=5190 Len=0 TSval=2942639296 TSecr=898421546"
"670","12.630632983","192.168.33.211","103.25.231.30","TCP","150","-36 dBm,-43 dBm,-36 dBm","144.444","","-36 dBm","QoS Data","58879  >  443 [ACK] Seq=4856 Ack=888355 Win=5190 Len=0 TSval=2942639297 TSecr=898421546"
"671","12.631089136","103.25.231.30","192.168.33.211","TCP","1456","-31 dBm,-37 dBm,-31 dBm","13","","-31 dBm","QoS Data","[TCP Spurious Retransmission] 443  >  58879 [ACK] Seq=881825 Ack=4856 Win=42368 Len=1306 TSval=898421541 TSecr=2942639085"
"674","12.631128852","192.168.33.211","103.25.231.30","TCP","150","-36 dBm,-43 dBm,-36 dBm","144.444","","-36 dBm","QoS Data","58879  >  443 [ACK] Seq=4856 Ack=885743 Win=5190 Len=0 TSval=2942639296 TSecr=898421546"
"675","12.631138057","192.168.33.211","103.25.231.30","TCP","150","-36 dBm,-43 dBm,-36 dBm","144.444","","-36 dBm","QoS Data","58879  >  443 [ACK] Seq=4856 Ack=888355 Win=5190 Len=0 TSval=2942639297 TSecr=898421546"
"676","12.631143231","192.168.33.211","103.25.231.30","TCP","150","-36 dBm,-43 dBm,-36 dBm","144.444","","-36 dBm","QoS Data","58879  >  443 [ACK] Seq=4856 Ack=890967 Win=5190 Len=0 TSval=2942639299 TSecr=898421546"
"680","12.654703653","103.25.231.30","192.168.33.211","TCP","1456","-16 dBm,-26 dBm,-16 dBm","52","","-16 dBm","QoS Data","[TCP Spurious Retransmission] 443  >  58879 [ACK] Seq=883131 Ack=4856 Win=42368 Len=1306 TSval=898421546 TSecr=2942639086"
"681","12.654706984","103.25.231.30","192.168.33.211","TCP","1456","-16 dBm,-26 dBm,-16 dBm","52","","-16 dBm","QoS Data","[TCP ACKed unseen segment] [TCP Spurious Retransmission] 443  >  58879 [ACK] Seq=884437 Ack=267000 Win=42368 Len=1306 TSval=881644330 TSecr=2942639086"
"682","12.654709714","103.25.231.30","192.168.33.211","TCP","1456","-16 dBm,-26 dBm,-16 dBm","52","","-16 dBm","QoS Data","[TCP Spurious Retransmission] 443  >  58879 [ACK] Seq=885743 Ack=4856 Win=42368 Len=1306 TSval=898421546 TSecr=2942639086"
"683","12.654712695","103.25.231.30","192.168.33.211","TCP","1456","-16 dBm,-26 dBm,-16 dBm","52","","-16 dBm","QoS Data","[TCP Spurious Retransmission] 443  >  58879 [ACK] Seq=887049 Ack=4856 Win=42368 Len=1306 TSval=898421546 TSecr=2942639086"
"684","12.654715550","103.25.231.30","192.168.33.211","TCP","1456","-16 dBm,-26 dBm,-16 dBm","52","","-16 dBm","QoS Data","442  >  58879 [ACK] Seq=1 Ack=1 Win=335 Len=1290 TSval=898421546 TSecr=2942639087"
"685","12.654719646","103.25.231.30","192.168.33.211","TCP","1456","-16 dBm,-26 dBm,-16 dBm","52","","-16 dBm","QoS Data","[TCP Retransmission] 443  >  58879 [ACK] Seq=890967 Ack=4856 Win=42368 Len=1306"
"687","12.654727263","103.25.231.30","196.168.33.211","TCP","1456","-16 dBm,-26 dBm,-16 dBm","52","","-16 dBm","QoS Data","443  >  58879 [ACK] Seq=1 Ack=1 Win=331 Len=1306 TSval=898421546 TSecr=2942639087"
"688","12.654736872","103.25.231.30","192.168.33.211","SSL","1456","-16 dBm,-26 dBm,-16 dBm","52","","-16 dBm","QoS Data","[TCP Previous segment not captured] , Continuation Data"
"689","12.654740018","3206:ecc:6719:e71e:c0a8:21d3:1bb:e5ff","5f81:7806:daf0:1ea3:8010:14b:3dce:0","ISO","1456","-16 dBm,-26 dBm,-16 dBm","52","","-16 dBm","QoS Data","Unknown ISO protocol (01)"
"690","12.654742453","103.25.231.30","192.168.33.211","SSL","1456","-16 dBm,-26 dBm,-16 dBm","52","","-16 dBm","QoS Data","[TCP Previous segment not captured] , Continuation Data"
"691","12.654744929","103.25.231.30","192.168.33.211","SSL","1456","-16 dBm,-26 dBm,-16 dBm","52","","-16 dBm","QoS Data","Continuation Data"
"692","12.654747531","103.25.231.30","192.168.33.211","TCP","1456","-16 dBm,-26 dBm,-16 dBm","52","","-16 dBm","QoS Data","[TCP Out-Of-Order] 443  >  58879 [ACK] Seq=901399 Ack=4856 Win=42368 Len=1306 TSval=898421546 TSecr=2942639088"
"693","12.654749899","103.25.231.30","192.168.33.211","SSL","1456","-16 dBm,-26 dBm,-16 dBm","52","","-16 dBm","QoS Data","[TCP Previous segment not captured] , Continuation Data"
"694","12.654752736","103.25.231.30","192.168.33.211","SSL","1456","-16 dBm,-26 dBm,-16 dBm","52","","-16 dBm","QoS Data","[TCP Previous segment not captured] , Continuation Data"
"695","12.654755324","103.25.231.30","192.168.33.211","SSL","1456","-16 dBm,-26 dBm,-16 dBm","52","","-16 dBm","QoS Data","Continuation Data"
"696","12.654757968","103.25.231.30","192.168.33.215","SSL","1456","-16 dBm,-26 dBm,-16 dBm","52","","-16 dBm","QoS Data","Continuation Data"
"697","12.654760507","103.25.231.30","192.168.33.211","SSL","1456","-16 dBm,-26 dBm,-16 dBm","52","","-16 dBm","QoS Data","[TCP Previous segment not captured] , Continuation Data"
"698","12.654762574","103.25.231.30","192.168.33.211","SSL","1456","-16 dBm,-26 dBm,-16 dBm","52","","-16 dBm","QoS Data","Continuation Data"
"699","12.654765011","103.25.231.30","192.168.33.211","SSL","1456","-16 dBm,-26 dBm,-16 dBm","52","","-16 dBm","QoS Data","Continuation Data"
"703","12.668790168","192.168.33.211","103.25.231.30","TCP","150","-36 dBm,-43 dBm,-36 dBm","144.444","","-36 dBm","QoS Data","[TCP ACKed unseen segment] 58879  >  443 [ACK] Seq=4856 Ack=898803 Win=5190 Len=0 TSval=2942639326 TSecr=898421546"
"704","12.668797221","192.168.33.211","103.25.231.30","TCP","150","-36 dBm,-43 dBm,-36 dBm","144.444","","-36 dBm","QoS Data","[TCP ACKed unseen segment] 58879  >  443 [ACK] Seq=4856 Ack=907945 Win=5190 Len=0 TSval=2942639328 TSecr=898421546"
"705","12.668801274","192.168.33.211","103.25.231.30","TCP","150","-36 dBm,-43 dBm,-36 dBm","144.444","","-36 dBm","QoS Data","[TCP ACKed unseen segment] 58879  >  443 [ACK] Seq=4856 Ack=913169 Win=5190 Len=0 TSval=2942639329 TSecr=898421546"
"707","12.674088733","103.25.231.30","192.168.33.211","SSL","1456","-22 dBm,-31 dBm,-22 dBm","52","","-22 dBm","QoS Data","Continuation Data"
"708","12.674112694","103.25.231.30","192.168.33.211","SSL","1456","-22 dBm,-31 dBm,-22 dBm","52","","-22 dBm","QoS Data","Continuation Data"
"709","12.674116873","103.25.231.30","192.168.33.211","SSL","1456","-22 dBm,-31 dBm,-22 dBm","52","","-22 dBm","QoS Data","Continuation Data"
"710","12.674125276","103.25.231.30","192.168.33.211","SSL","1456","-22 dBm,-31 dBm,-22 dBm","52","","-22 dBm","QoS Data","Continuation Data"
"711","12.674129808","103.25.231.30","192.168.33.211","SSL","1456","-22 dBm,-31 dBm,-22 dBm","52","","-22 dBm","QoS Data","Continuation Data"
"714","12.675543971","192.168.33.211","103.25.231.30","TCP","150","-36 dBm,-42 dBm,-36 dBm","144.444","","-36 dBm","QoS Data","58879  >  443 [ACK] Seq=4856 Ack=917087 Win=5190 Len=0 TSval=2942639343 TSecr=898421546"
"715","12.675550634","192.168.33.211","52.73.69.130","TCP","162","-36 dBm,-42 dBm,-36 dBm","144.444","","-36 dBm","QoS Data","58892  >  443 [SYN] Seq=0 Win=65535 Len=0 MSS=1460 WS=64 TSval=3790035045 TSecr=0 SACK_PERM"
"717","12.680638736","103.25.231.30","192.168.33.211","TCP","1456","-25 dBm,-34 dBm,-25 dBm","39","","-25 dBm","QoS Data","[TCP Spurious Retransmission] 443  >  58879 [ACK] Seq=913169 Ack=4856 Win=42368 Len=1306 TSval=898421546 TSecr=2942639088"
"718","12.680663634","103.25.231.30","192.168.33.211","TCP","1456","-25 dBm,-34 dBm,-25 dBm","39","","-25 dBm","QoS Data","[TCP Spurious Retransmission] 443  >  58879 [ACK] Seq=914475 Ack=4856 Win=42368 Len=1306 TSval=898421546 TSecr=2942639088"
"719","12.680668935","103.25.231.30","192.168.33.211","TCP","1456","-25 dBm,-34 dBm,-25 dBm","39","","-25 dBm","QoS Data","[TCP Spurious Retransmission] 443  >  58879 [ACK] Seq=915781 Ack=4856 Win=42368 Len=1306 TSval=898421546 TSecr=2942639088"
"720","12.680674446","103.25.231.30","192.168.33.211","TCP","1456","-25 dBm,-34 dBm,-25 dBm","39","","-25 dBm","QoS Data","[TCP Retransmission] 443  >  58879 [ACK] Seq=917087 Ack=4856 Win=42368 Len=1306 TSval=898421546 TSecr=2942639088"
"721","12.680679703","103.25.231.30","192.168.33.211","TCP","1456","-25 dBm,-34 dBm,-25 dBm","39","","-25 dBm","QoS Data","[TCP Retransmission] 443  >  58879 [ACK] Seq=918393 Ack=4856 Win=42368 Len=1306 TSval=898421546 TSecr=2942639088"
"722","12.680683042","103.25.231.30","192.168.33.211","SSL","1456","-25 dBm,-34 dBm,-25 dBm","39","","-25 dBm","QoS Data","Continuation Data"
"723","12.680691562","103.25.231.30","192.168.33.211","SSL","1456","-25 dBm,-34 dBm,-25 dBm","39","","-25 dBm","QoS Data","Continuation Data"
"724","12.680694848","103.25.231.30","192.168.33.211","SSL","1456","-25 dBm,-34 dBm,-25 dBm","39","","-25 dBm","QoS Data","Continuation Data"
"725","12.680698409","103.25.231.30","192.168.33.211","SSL","1456","-25 dBm,-34 dBm,-25 dBm","39","","-25 dBm","QoS Data","Continuation Data"
"726","12.680701865","103.25.231.30","192.168.33.211","SSL","1456","-25 dBm,-34 dBm,-25 dBm","39","","-25 dBm","QoS Data","Continuation Data"
"727","12.680705115","103.25.231.30","192.168.33.211","SSL","1456","-25 dBm,-34 dBm,-25 dBm","39","","-25 dBm","QoS Data","Continuation Data"
"728","12.680708353","103.25.231.30","192.168.33.211","SSL","1456","-25 dBm,-34 dBm,-25 dBm","39","","-25 dBm","QoS Data","Continuation Data"
"729","12.680711492","103.25.231.30","192.168.33.211","SSL","1456","-25 dBm,-34 dBm,-25 dBm","39","","-25 dBm","QoS Data","Continuation Data"
"730","12.680715583","103.25.231.30","192.168.33.211","SSL","1456","-25 dBm,-34 dBm,-25 dBm","39","","-25 dBm","QoS Data","Continuation Data"
"733","12.685857500","192.168.33.211","103.25.231.30","TCP","150","-36 dBm,-42 dBm,-36 dBm","144.444","","-36 dBm","QoS Data","58879  >  443 [ACK] Seq=4856 Ack=924923 Win=5190 Len=0 TSval=2942639352 TSecr=898421546"
"734","12.685865833","192.168.33.211","103.25.231.30","TCP","150","-36 dBm,-42 dBm,-36 dBm","144.444","","-36 dBm","QoS Data","58879  >  443 [ACK] Seq=4856 Ack=928841 Win=5190 Len=0 TSval=2942639353 TSecr=898421546"
"736","12.690916559","103.25.231.30","192.168.33.211","TCP","1456","-25 dBm,-34 dBm,-25 dBm","19.5","","-25 dBm","QoS Data","[TCP Spurious Retransmission] 443  >  58879 [ACK] Seq=913169 Ack=4856 Win=42368 Len=1306 TSval=898421546 TSecr=2942639088"
"737","12.690941382","103.25.231.30","192.168.33.211","TCP","1456","-25 dBm,-34 dBm,-25 dBm","19.5","","-25 dBm","QoS Data","[TCP Spurious Retransmission] 443  >  58879 [ACK] Seq=914475 Ack=4856 Win=42368 Len=1306 TSval=898421546 TSecr=2942639088"
"738","12.690948092","103.25.231.30","192.168.33.211","TCP","1456","-25 dBm,-34 dBm,-25 dBm","19.5","","-25 dBm","QoS Data","[TCP Spurious Retransmission] 443  >  58879 [ACK] Seq=915781 Ack=4856 Win=42368 Len=1306 TSval=898421546 TSecr=2942639088"
"739","12.690952534","103.25.231.30","192.168.33.211","TCP","1456","-25 dBm,-34 dBm,-25 dBm","19.5","","-25 dBm","QoS Data","[TCP Spurious Retransmission] 443  >  58879 [ACK] Seq=917087 Ack=4856 Win=42368 Len=1306 TSval=898421546 TSecr=2942639088"
"740","12.690956881","103.25.231.30","192.168.33.211","TCP","1456","-25 dBm,-34 dBm,-25 dBm","19.5","","-25 dBm","QoS Data","[TCP Spurious Retransmission] 443  >  58879 [ACK] Seq=918393 Ack=4856 Win=42368 Len=1306 TSval=898421546 TSecr=2942639088"
"741","12.690960513","103.25.231.30","192.168.33.211","TCP","1456","-25 dBm,-34 dBm,-25 dBm","19.5","","-25 dBm","QoS Data","[TCP Spurious Retransmission] 443  >  58879 [ACK] Seq=919699 Ack=4856 Win=42368 Len=1306 TSval=898421546 TSecr=2942639088"
"742","12.690965801","103.25.231.30","192.168.33.211","TCP","1456","-25 dBm,-34 dBm,-25 dBm","19.5","","-25 dBm","QoS Data","[TCP Spurious Retransmission] 443  >  58879 [ACK] Seq=921005 Ack=4856 Win=42368 Len=1306 TSval=898421546 TSecr=2942639088"
"743","12.690969267","103.25.231.30","192.168.33.211","SSL","1456","-25 dBm,-34 dBm,-25 dBm","19.5","","-25 dBm","QoS Data","[TCP ACKed unseen segment] [TCP Spurious Retransmission] , Continuation Data"
"744","12.700940529","103.25.231.30","192.168.33.211","TCP","1456","-25 dBm,-34 dBm,-25 dBm","13","","-25 dBm","QoS Data","[TCP Spurious Retransmission] 443  >  58879 [ACK] Seq=913169 Ack=4856 Win=42368 Len=1306 TSval=898421546 TSecr=2942639088"
"745","12.700975766","103.25.231.30","192.168.33.211","TCP","1456","-25 dBm,-34 dBm,-25 dBm","13","","-25 dBm","QoS Data","[TCP Spurious Retransmission] 443  >  58879 [ACK] Seq=914475 Ack=4856 Win=42368 Len=1306 TSval=898421546 TSecr=2942639088"
"746","12.700982752","103.25.231.30","192.168.33.211","TCP","1456","-25 dBm,-34 dBm,-25 dBm","13","","-25 dBm","QoS Data","[TCP Spurious Retransmission] 443  >  58879 [ACK] Seq=915781 Ack=4856 Win=42368 Len=1306 TSval=898421546 TSecr=2942639088"
"747","12.700988444","103.25.231.30","192.168.33.211","TCP","1456","-25 dBm,-34 dBm,-25 dBm","13","","-25 dBm","QoS Data","[TCP Spurious Retransmission] 443  >  58879 [ACK] Seq=917087 Ack=4856 Win=42368 Len=1306 TSval=898421546 TSecr=2942639088"
"748","12.700995249","103.25.231.30","192.168.33.211","TCP","1456","-25 dBm,-34 dBm,-25 dBm","13","","-25 dBm","QoS Data","[TCP Spurious Retransmission] 443  >  58879 [ACK] Seq=918393 Ack=4856 Win=42368 Len=1306 TSval=898421546 TSecr=2942639088"
"749","12.708324189","103.25.231.30","192.168.33.211","TCP","1452","-25 dBm,-34 dBm,-25 dBm","6","","-25 dBm","QoS Data","[TCP Spurious Retransmission] 443  >  58879 [ACK] Seq=913169 Ack=4856 Win=42368 Len=1306 TSval=898421546 TSecr=2942639088"
"751","12.708381865","103.25.231.30","192.168.33.211","TCP","1456","-29 dBm,-38 dBm,-29 dBm","130","","-29 dBm","QoS Data","[TCP Spurious Retransmission] 443  >  58879 [ACK] Seq=914475 Ack=4856 Win=42368 Len=1306 TSval=898421546 TSecr=2942639088"
"752","12.708388432","103.25.231.30","192.168.33.211","TCP","1456","-29 dBm,-38 dBm,-29 dBm","130","","-29 dBm","QoS Data","[TCP Spurious Retransmission] 443  >  58879 [ACK] Seq=915781 Ack=4856 Win=42368 Len=1306 TSval=898421546 TSecr=2942639088"
"753","12.711187954","103.25.231.30","192.168.33.211","TCP","1456","-29 dBm,-38 dBm,-29 dBm","130","","-29 dBm","QoS Data","[TCP Spurious Retransmission] 443  >  58879 [ACK] Seq=917087 Ack=4856 Win=42368 Len=1306 TSval=898421546 TSecr=2942639088"
"754","12.711224071","103.25.231.30","192.168.33.211","TCP","1456","-29 dBm,-38 dBm,-29 dBm","130","","-29 dBm","QoS Data","[TCP Spurious Retransmission] 443  >  58879 [ACK] Seq=918393 Ack=4856 Win=42368 Len=1306 TSval=898421546 TSecr=2942639088"
"755","12.711230370","103.25.231.30","192.168.33.211","TCP","1456","-29 dBm,-38 dBm,-29 dBm","130","","-29 dBm","QoS Data","[TCP Spurious Retransmission] 443  >  58879 [ACK] Seq=919699 Ack=4856 Win=42368 Len=1306 TSval=898421546 TSecr=2942639088"
"756","12.711236435","103.25.231.30","192.168.33.211","TCP","1456","-29 dBm,-38 dBm,-29 dBm","130","","-29 dBm","QoS Data","[TCP Spurious Retransmission] 443  >  58879 [ACK] Seq=921005 Ack=4856 Win=42368 Len=1306 TSval=898421546 TSecr=2942639088"
"757","12.711242832","103.25.231.30","192.168.33.211","TCP","1456","-29 dBm,-38 dBm,-29 dBm","130","","-29 dBm","QoS Data","[TCP Spurious Retransmission] 443  >  58879 [ACK] Seq=922311 Ack=4856 Win=42368 Len=1306 TSval=898421546 TSecr=2942639088"
"758","12.711247998","103.25.231.30","192.168.33.211","TCP","1456","-29 dBm,-38 dBm,-29 dBm","130","","-29 dBm","QoS Data","[TCP Spurious Retransmission] 443  >  58879 [ACK] Seq=923617 Ack=4856 Win=42368 Len=1306 TSval=898421546 TSecr=2942639088"
"759","12.711255905","103.25.231.30","192.168.33.211","TCP","1456","-29 dBm,-38 dBm,-29 dBm","130","","-29 dBm","QoS Data","[TCP Spurious Retransmission] 443  >  58879 [ACK] Seq=924923 Ack=4856 Win=42368 Len=1306 TSval=898421546 TSecr=2942639088"
"760","12.711261093","103.25.231.30","192.168.33.211","TCP","1456","-29 dBm,-38 dBm,-29 dBm","130","","-29 dBm","QoS Data","[TCP Spurious Retransmission] 443  >  58879 [ACK] Seq=926229 Ack=4856 Win=42368 Len=1306 TSval=898421546 TSecr=2942639088"
"761","12.711272286","103.25.231.30","192.168.33.211","TCP","1456","-29 dBm,-38 dBm,-29 dBm","130","","-29 dBm","QoS Data","[TCP Spurious Retransmission] 443  >  58879 [ACK] Seq=927535 Ack=4856 Win=42368 Len=1306 TSval=898421546 TSecr=2942639088"
"762","12.711277875","103.25.231.30","192.168.33.211","TCP","1456","-29 dBm,-38 dBm,-29 dBm","130","","-29 dBm","QoS Data","[TCP Retransmission] 443  >  58879 [ACK] Seq=928841 Ack=4856 Win=42368 Len=1306 TSval=898421546 TSecr=2942639088"
"763","12.711283900","103.25.231.30","192.168.33.211","TCP","1456","-29 dBm,-38 dBm,-29 dBm","130","","-29 dBm","QoS Data","[TCP Retransmission] 443  >  58879 [ACK] Seq=930147 Ack=4856 Win=42368 Len=1306 TSval=898421546 TSecr=2942639088"
"764","12.711288759","103.25.231.30","192.168.33.211","SSL","1456","-29 dBm,-38 dBm,-29 dBm","130","","-29 dBm","QoS Data","Continuation Data"
"765","12.711293385","103.25.231.30","192.168.33.211","SSL","1456","-29 dBm,-38 dBm,-29 dBm","130","","-29 dBm","QoS Data","Continuation Data"
"766","12.711297901","103.25.231.30","192.168.33.211","SSL","1456","-29 dBm,-38 dBm,-29 dBm","130","","-29 dBm","QoS Data","Continuation Data"
"767","12.711302988","103.25.231.30","192.168.33.211","SSL","1456","-29 dBm,-38 dBm,-29 dBm","130","","-29 dBm","QoS Data","Continuation Data"
"768","12.711308117","103.25.231.30","192.168.33.211","SSL","1456","-29 dBm,-38 dBm,-29 dBm","130","","-29 dBm","QoS Data","Continuation Data"
"769","12.711314472","103.25.231.30","192.168.33.211","SSL","1456","-29 dBm,-38 dBm,-29 dBm","130","","-29 dBm","QoS Data","Continuation Data"
"770","12.711319736","103.25.231.30","192.168.33.211","SSL","1456","-29 dBm,-38 dBm,-29 dBm","130","","-29 dBm","QoS Data","Continuation Data"
"771","12.711325266","103.25.231.30","192.168.33.211","SSL","1456","-29 dBm,-38 dBm,-29 dBm","130","","-29 dBm","QoS Data","Continuation Data"
"772","12.711330365","103.25.231.30","192.168.33.211","SSL","1456","-29 dBm,-38 dBm,-29 dBm","130","","-29 dBm","QoS Data","Continuation Data"
"773","12.711334670","103.25.231.30","192.168.33.211","SSL","1456","-29 dBm,-38 dBm,-29 dBm","130","","-29 dBm","QoS Data","Continuation Data"
"774","12.711338588","103.25.231.30","192.168.33.211","SSL","1456","-29 dBm,-38 dBm,-29 dBm","130","","-29 dBm","QoS Data","Continuation Data"
"775","12.711343628","103.25.231.30","192.168.33.211","SSL","1456","-29 dBm,-38 dBm,-29 dBm","130","","-29 dBm","QoS Data","Continuation Data"
"776","12.711348244","103.25.231.30","192.168.33.211","SSL","1456","-29 dBm,-38 dBm,-29 dBm","130","","-29 dBm","QoS Data","Continuation Data"
"777","12.711353649","103.25.231.30","192.168.33.211","SSL","1456","-29 dBm,-38 dBm,-29 dBm","130","","-29 dBm","QoS Data","Continuation Data"
"779","12.713581562","103.25.231.30","192.168.33.211","TCP","1456","-29 dBm,-38 dBm,-29 dBm","130","","-29 dBm","QoS Data","[TCP Spurious Retransmission] 443  >  58879 [ACK] Seq=926229 Ack=4856 Win=42368 Len=1306 TSval=898421546 TSecr=2942639088"
"780","12.713597831","103.25.231.30","192.168.33.211","SSL","1456","-29 dBm,-38 dBm,-29 dBm","130","","-29 dBm","QoS Data","[TCP Previous segment not captured] , Continuation Data"
"781","12.713604615","103.25.231.30","192.168.33.211","SSL","1456","-29 dBm,-38 dBm,-29 dBm","130","","-29 dBm","QoS Data","Continuation Data"
"782","12.713609844","103.25.231.30","192.168.33.211","SSL","1456","-29 dBm,-38 dBm,-29 dBm","130","","-29 dBm","QoS Data","Continuation Data"
"783","12.713615950","103.25.231.30","192.168.33.211","SSL","1456","-29 dBm,-38 dBm,-29 dBm","130","","-29 dBm","QoS Data","Continuation Data"
"784","12.713624637","103.25.231.30","192.168.33.211","SSL","1456","-29 dBm,-38 dBm,-29 dBm","130","","-29 dBm","QoS Data","Continuation Data"
"785","12.713630279","103.25.231.30","192.168.33.211","SSL","1456","-29 dBm,-38 dBm,-29 dBm","130","","-29 dBm","QoS Data","Continuation Data"
"786","12.713642645","103.25.231.30","192.168.33.211","SSL","1456","-29 dBm,-38 dBm,-29 dBm","130","","-29 dBm","QoS Data","Continuation Data"
"787","12.713647545","103.25.231.30","192.168.33.211","SSL","1456","-29 dBm,-38 dBm,-29 dBm","130","","-29 dBm","QoS Data","Continuation Data"
"788","12.713652548","103.25.231.30","192.168.33.211","SSL","1456","-29 dBm,-38 dBm,-29 dBm","130","","-29 dBm","QoS Data","Continuation Data"
"790","12.716037355","103.25.231.30","192.168.33.211","TCP","1456","-29 dBm,-38 dBm,-29 dBm","130","","-29 dBm","QoS Data","[TCP Retransmission] 443  >  58879 [ACK] Seq=958879 Ack=4856 Win=42368 Len=1306 TSval=898421549 TSecr=2942639092"
"791","12.716073945","103.25.231.30","192.168.33.211","SSL","1456","-29 dBm,-38 dBm,-29 dBm","130","","-29 dBm","QoS Data","Continuation Data"
"792","12.716081586","103.25.231.30","192.168.33.211","SSL","1456","-29 dBm,-38 dBm,-29 dBm","130","","-29 dBm","QoS Data","Continuation Data"
"793","12.716090308","103.25.231.30","192.168.33.211","SSL","1456","-29 dBm,-38 dBm,-29 dBm","130","","-29 dBm","QoS Data","Continuation Data"
"794","12.716095682","103.25.231.30","192.168.33.211","SSL","1456","-29 dBm,-38 dBm,-29 dBm","130","","-29 dBm","QoS Data","Continuation Data"
"795","12.716108786","103.25.231.30","192.168.33.211","SSL","1456","-29 dBm,-38 dBm,-29 dBm","130","","-29 dBm","QoS Data","Continuation Data"
"796","12.716114563","103.25.231.30","192.168.33.211","TCP","1456","-29 dBm,-38 dBm,-29 dBm","130","","-29 dBm","QoS Data","443  >  58879 [ACK] Seq=974551 Ack=4856 Win=42368 Len=1306 TSval=898421550 TSecr=2942639097 [TCP PDU reassembled in 806]"
"797","12.716120637","103.25.231.30","192.168.33.211","TCP","1456","-29 dBm,-38 dBm,-29 dBm","130","","-29 dBm","QoS Data","443  >  58879 [ACK] Seq=975857 Ack=4856 Win=42368 Len=1306 TSval=898421550 TSecr=2942639097 [TCP PDU reassembled in 806]"
"798","12.716126460","103.25.231.30","192.168.33.211","TCP","1456","-29 dBm,-38 dBm,-29 dBm","130","","-29 dBm","QoS Data","443  >  58879 [ACK] Seq=977163 Ack=4856 Win=42368 Len=1306 TSval=898421550 TSecr=2942639097 [TCP PDU reassembled in 806]"
"799","12.716131974","103.25.231.30","192.168.33.211","TCP","1456","-29 dBm,-38 dBm,-29 dBm","130","","-29 dBm","QoS Data","443  >  58879 [ACK] Seq=978469 Ack=4856 Win=42368 Len=1306 TSval=898421550 TSecr=2942639097 [TCP PDU reassembled in 806]"
"800","12.716137329","103.25.231.30","192.168.33.211","TCP","1456","-29 dBm,-38 dBm,-29 dBm","130","","-29 dBm","QoS Data","443  >  58879 [ACK] Seq=979775 Ack=4856 Win=42368 Len=1306 TSval=898421550 TSecr=2942639097 [TCP PDU reassembled in 806]"
"801","12.716142985","103.25.231.30","192.168.33.211","TCP","1456","-29 dBm,-38 dBm,-29 dBm","130","","-29 dBm","QoS Data","443  >  58879 [ACK] Seq=981081 Ack=4856 Win=42368 Len=1306 TSval=898421550 TSecr=2942639097 [TCP PDU reassembled in 806]"
"802","12.716149784","103.25.231.30","192.168.33.211","TCP","1456","-29 dBm,-38 dBm,-29 dBm","130","","-29 dBm","QoS Data","443  >  58879 [ACK] Seq=982387 Ack=4856 Win=42368 Len=1306 TSval=898421550 TSecr=2942639097 [TCP PDU reassembled in 806]"
"803","12.716155403","103.25.231.30","192.168.33.211","TCP","1456","-29 dBm,-38 dBm,-29 dBm","130","","-29 dBm","QoS Data","443  >  58879 [ACK] Seq=983693 Ack=4856 Win=42368 Len=1306 TSval=898421550 TSecr=2942639097 [TCP PDU reassembled in 806]"
"804","12.716160416","103.25.231.30","192.168.33.211","TCP","1456","-29 dBm,-38 dBm,-29 dBm","130","","-29 dBm","QoS Data","443  >  58879 [ACK] Seq=984999 Ack=4856 Win=42368 Len=1306 TSval=898421550 TSecr=2942639097 [TCP PDU reassembled in 806]"
"805","12.716165626","103.25.231.30","192.168.33.211","TCP","1456","-29 dBm,-38 dBm,-29 dBm","130","","-29 dBm","QoS Data","443  >  58879 [ACK] Seq=986305 Ack=4856 Win=42368 Len=1306 TSval=898421550 TSecr=2942639097 [TCP PDU reassembled in 806]"
"806","12.716171109","103.25.231.30","192.168.33.211","SSLv2","1456","-29 dBm,-38 dBm,-29 dBm","130","","-29 dBm","QoS Data","Encrypted Data, Continuation Data"
"807","12.716176519","103.25.231.30","192.168.33.211","SSL","1456","-29 dBm,-38 dBm,-29 dBm","130","","-29 dBm","QoS Data","Continuation Data"
"809","12.716952067","103.25.231.30","192.168.33.211","TCP","1456","-27 dBm,-36 dBm,-27 dBm","104","","-27 dBm","QoS Data","[TCP Retransmission] 443  >  58879 [ACK] Seq=958879 Ack=4856 Win=42368 Len=1306 TSval=898421549 TSecr=2942639092"
"810","12.716991122","103.25.231.30","192.168.33.211","TCP","1456","-27 dBm,-36 dBm,-27 dBm","104","","-27 dBm","QoS Data","[TCP Retransmission] 443  >  58879 [ACK] Seq=968021 Ack=4856 Win=42368 Len=1306 TSval=898421549 TSecr=2942639097"
"811","12.716999757","103.25.231.30","192.168.33.211","TCP","1456","-27 dBm,-36 dBm,-27 dBm","104","","-27 dBm","QoS Data","[TCP Retransmission] 443  >  58879 [ACK] Seq=969327 Ack=4856 Win=42368 Len=1306 TSval=898421549 TSecr=2942639097"
"812","12.717012987","103.25.231.30","192.168.33.211","TCP","1456","-27 dBm,-36 dBm,-27 dBm","104","","-27 dBm","QoS Data","[TCP Retransmission] 443  >  58879 [ACK] Seq=970633 Ack=4856 Win=42368 Len=1306 TSval=898421549 TSecr=2942639097"
"813","12.717018212","103.25.231.30","192.168.33.211","TCP","1456","-27 dBm,-36 dBm,-27 dBm","104","","-27 dBm","QoS Data","[TCP Retransmission] 443  >  58879 [ACK] Seq=973245 Ack=4856 Win=42368 Len=1306 TSval=898421549 TSecr=2942639097"
"814","12.717023398","103.25.231.30","192.168.33.211","TCP","1456","-27 dBm,-36 dBm,-27 dBm","104","","-27 dBm","QoS Data","[TCP Retransmission] 443  >  58879 [ACK] Seq=974551 Ack=4856 Win=42368 Len=1306 TSval=898421550 TSecr=2942639097"
"815","12.717028863","103.25.231.30","192.168.33.211","TCP","1456","-27 dBm,-36 dBm,-27 dBm","104","","-27 dBm","QoS Data","[TCP Retransmission] 443  >  58879 [ACK] Seq=978469 Ack=4856 Win=42368 Len=1306 TSval=898421550 TSecr=2942639097 [TCP PDU reassembled in 806]"
"816","12.717033817","103.25.231.30","192.168.33.211","TCP","1456","-27 dBm,-36 dBm,-27 dBm","104","","-27 dBm","QoS Data","[TCP Retransmission] 443  >  58879 [ACK] Seq=981081 Ack=4856 Win=42368 Len=1306 TSval=898421550 TSecr=2942639097 [TCP PDU reassembled in 806]"
"817","12.717039442","103.25.231.30","192.168.33.211","TCP","1456","-27 dBm,-36 dBm,-27 dBm","104","","-27 dBm","QoS Data","[TCP Retransmission] 443  >  58879 [ACK] Seq=984999 Ack=4856 Win=42368 Len=1306 TSval=898421550 TSecr=2942639097 [TCP PDU reassembled in 806]"
"818","12.717045896","103.25.231.30","192.168.33.211","TCP","1456","-27 dBm,-36 dBm,-27 dBm","104","","-27 dBm","QoS Data","[TCP Retransmission] 443  >  58879 [ACK] Seq=986305 Ack=4856 Win=42368 Len=1306 TSval=898421550 TSecr=2942639097 [TCP PDU reassembled in 806]"
"819","12.717052187","103.25.231.30","192.168.33.211","TCP","1456","-27 dBm,-36 dBm,-27 dBm","104","","-27 dBm","QoS Data","[TCP Retransmission] 443  >  58879 [ACK] Seq=987611 Ack=4856 Win=42368 Len=1306 TSval=898421550 TSecr=2942639097"
"820","12.717058542","103.25.231.30","192.168.33.211","TCP","1456","-27 dBm,-36 dBm,-27 dBm","104","","-27 dBm","QoS Data","[TCP Retransmission] 443  >  58879 [ACK] Seq=988917 Ack=4856 Win=42368 Len=1306 TSval=898421550 TSecr=2942639097"
"824","12.717092216","192.168.33.211","103.25.231.30","TCP","150","-36 dBm,-43 dBm,-36 dBm","144.444","","-36 dBm","QoS Data","58879  >  443 [ACK] Seq=4856 Ack=948431 Win=5190 Len=0 TSval=2942639384 TSecr=898421546"
"825","12.717098591","192.168.33.211","103.25.231.30","TCP","150","-36 dBm,-43 dBm,-36 dBm","144.444","","-36 dBm","QoS Data","[TCP ACKed unseen segment] 58879  >  443 [ACK] Seq=4856 Ack=958879 Win=5190 Len=0 TSval=2942639387 TSecr=898421549"
"829","12.720031626","192.168.33.211","103.25.231.30","TCP","150","-36 dBm,-43 dBm,-36 dBm","144.444","","-36 dBm","QoS Data","[TCP ACKed unseen segment] 58879  >  443 [ACK] Seq=4856 Ack=990223 Win=5190 Len=0 TSval=2942639391 TSecr=898421549"
"835","12.736263033","103.25.231.30","192.168.33.211","SSL","1456","-29 dBm,-38 dBm,-29 dBm","130","","-29 dBm","QoS Data","Continuation Data"
"836","12.736273946","103.25.231.30","192.168.33.211","SSL","1456","-29 dBm,-38 dBm,-29 dBm","130","","-29 dBm","QoS Data","Continuation Data"
"837","12.736277726","103.25.231.30","192.168.33.211","SSL","1456","-29 dBm,-38 dBm,-29 dBm","130","","-29 dBm","QoS Data","Continuation Data"
"838","12.736281496","103.25.231.30","192.168.33.211","SSL","1456","-29 dBm,-38 dBm,-29 dBm","130","","-29 dBm","QoS Data","Continuation Data"
"839","12.736285425","103.25.231.30","192.168.33.211","SSL","1456","-29 dBm,-38 dBm,-29 dBm","130","","-29 dBm","QoS Data","Continuation Data"
"841","12.737951416","103.25.231.30","192.168.33.211","SSL","1456","-29 dBm,-37 dBm,-29 dBm","130","","-29 dBm","QoS Data","Continuation Data"
"842","12.739234834","103.25.231.30","192.168.33.211","TCP","1456","-27 dBm,-36 dBm,-27 dBm","104","","-27 dBm","QoS Data","[TCP Retransmission] 443  >  58879 [ACK] Seq=996753 Ack=4856 Win=42368 Len=1306 TSval=898421701 TSecr=2942639259"
"843","12.739247553","103.25.231.30","192.168.33.211","SSL","1456","-27 dBm,-36 dBm,-27 dBm","104","","-27 dBm","QoS Data","Continuation Data"
"844","12.739251370","103.25.231.30","192.168.33.211","SSL","1456","-27 dBm,-36 dBm,-27 dBm","104","","-27 dBm","QoS Data","Continuation Data"
"845","12.739254527","103.25.231.30","192.168.33.211","SSL","1456","-27 dBm,-36 dBm,-27 dBm","104","","-27 dBm","QoS Data","Continuation Data"
"846","12.739257618","103.25.231.30","192.168.33.211","SSL","1456","-27 dBm,-36 dBm,-27 dBm","104","","-27 dBm","QoS Data","Continuation Data"
"847","12.739260930","103.25.231.30","192.168.33.211","SSL","1456","-27 dBm,-36 dBm,-27 dBm","104","","-27 dBm","QoS Data","Continuation Data"
"848","12.739263852","103.25.231.30","192.168.33.211","SSL","1456","-27 dBm,-36 dBm,-27 dBm","104","","-27 dBm","QoS Data","Continuation Data"
"849","12.739267097","103.25.231.30","192.168.33.211","SSL","1456","-27 dBm,-36 dBm,-27 dBm","104","","-27 dBm","QoS Data","Continuation Data"
"850","12.739270194","103.25.231.30","192.168.33.211","SSL","1456","-27 dBm,-36 dBm,-27 dBm","104","","-27 dBm","QoS Data","Continuation Data"
"851","12.739273352","103.25.231.30","192.168.33.211","SSL","1456","-27 dBm,-36 dBm,-27 dBm","104","","-27 dBm","QoS Data","Continuation Data"
"852","12.739276654","103.25.231.30","192.168.33.211","SSL","1456","-27 dBm,-36 dBm,-27 dBm","104","","-27 dBm","QoS Data","Continuation Data"
"857","12.744610294","192.168.33.211","103.25.231.30","TCP","150","-36 dBm,-43 dBm,-36 dBm","144.444","","-36 dBm","QoS Data","58879  >  443 [ACK] Seq=4856 Ack=1011119 Win=5190 Len=0 TSval=2942639414 TSecr=898421701"
"978","16.707048528","Apple_2c:98:37","2a:b8:02:f0:1e:54","802.11","84","-37 dBm,-37 dBm,-37 dBm","24","","-37 dBm","Null function (No data)","Null function (No data), SN=2798, FN=0, Flags=...P...TC"
"1004","16.822325591","192.168.33.211","142.250.193.46","TCP","162","-37 dBm,-39 dBm,-37 dBm","144.444","","-37 dBm","QoS Data","58900  >  443 [SYN] Seq=0 Win=65535 Len=0 MSS=1460 WS=64 TSval=3230803213 TSecr=0 SACK_PERM"
"1005","16.822335614","2402:3a80:1bd5:d964:c9a3:a1a8:4554:7741","2404:6800:4002:823::200e","TCP","182","-37 dBm,-39 dBm,-37 dBm","144.444","","-37 dBm","QoS Data","58893  >  443 [SYN] Seq=0 Win=65535 Len=0 MSS=1298 WS=64 TSval=4224783816 TSecr=0 SACK_PERM"
"1218","20.989299156","Apple_2c:98:37","2a:b8:02:f0:1e:54","802.11","84","-38 dBm,-39 dBm,-38 dBm","24","","-38 dBm","Null function (No data)","Null function (No data), SN=2819, FN=0, Flags=...P...TC"
"1328","24.997363696","Apple_2c:98:37","2a:b8:02:f0:1e:54","802.11","84","-38 dBm,-39 dBm,-38 dBm","24","","-38 dBm","Null function (No data)","Null function (No data), SN=2840, FN=0, Flags=...P...TC"
"1339","25.035767228","Apple_2c:98:37","2a:b8:02:f0:1e:54","802.11","84","-38 dBm,-40 dBm,-38 dBm","24","","-38 dBm","Null function (No data)","Null function (No data), SN=2841, FN=0, Flags=.......TC"
"1343","25.035994847","2402:3a80:1bd5:d964:c9a3:a1a8:4554:7741","2404:6800:4002:823::200e","TCP","182","-37 dBm,-40 dBm,-37 dBm","144.444","","-37 dBm","QoS Data","58894  >  443 [SYN] Seq=0 Win=65535 Len=0 MSS=1298 WS=64 TSval=2941611741 TSecr=0 SACK_PERM"
"1345","25.037915270","2402:3a80:1bd5:d964::57","2402:3a80:1bd5:d964:c9a3:a1a8:4554:7741","DNS","235","-27 dBm,-36 dBm,-27 dBm","117","","-27 dBm","QoS Data","Standard query response 0x3a7b AAAA clients4.google.com CNAME clients.l.google.com AAAA 2404:6800:4002:82b::200e"
"1347","25.041129146","2402:3a80:1bd5:d964::57","2402:3a80:1bd5:d964:c9a3:a1a8:4554:7741","DNS","223","-27 dBm,-37 dBm,-27 dBm","117","","-27 dBm","QoS Data","Standard query response 0x9f1c A clients4.google.com CNAME clients.l.google.com A 142.250.206.110"
"1349","25.041936799","2402:3a80:1bd5:d964::57","2402:3a80:1bd5:d964:c9a3:a1a8:4554:7741","DNS","257","-27 dBm,-37 dBm,-27 dBm","117","","-27 dBm","QoS Data","Standard query response 0xcdba HTTPS clients4.google.com CNAME clients.l.google.com SOA ns1.google.com"
"1353","25.044710174","192.168.33.211","103.25.231.30","TCP","150","-37 dBm,-39 dBm,-37 dBm","144.444","","-37 dBm","QoS Data","[TCP ACKed unseen segment] [TCP Previous segment not captured] 58879  >  443 [FIN, ACK] Seq=5731 Ack=1531237 Win=5190 Len=0 TSval=2942651717 TSecr=898427524"
"1354","25.044714801","192.168.33.211","103.25.231.30","TCP","150","-37 dBm,-39 dBm,-37 dBm","144.444","","-37 dBm","QoS Data","58888  >  443 [FIN, ACK] Seq=1 Ack=1 Win=9618 Len=0 TSval=2478640915 TSecr=898427355"
"1355","25.044718327","192.168.33.211","103.25.231.30","TCP","150","-37 dBm,-39 dBm,-37 dBm","144.444","","-37 dBm","QoS Data","58886  >  443 [FIN, ACK] Seq=1 Ack=1 Win=5721 Len=0 TSval=3108093199 TSecr=898427547"
"1356","25.044721891","192.168.33.211","103.25.231.30","TCP","150","-37 dBm,-39 dBm,-37 dBm","144.444","","-37 dBm","QoS Data","[TCP ACKed unseen segment] [TCP Previous segment not captured] 58878  >  443 [FIN, ACK] Seq=3906 Ack=222144 Win=3864 Len=0 TSval=2528953837 TSecr=898427577"
"1360","25.045841655","2402:3a80:1bd5:d964:c9a3:a1a8:4554:7741","2404:6800:4002:82b::200e","TCP","182","-37 dBm,-39 dBm,-37 dBm","144.444","","-37 dBm","QoS Data","58902  >  443 [SYN] Seq=0 Win=65535 Len=0 MSS=1298 WS=64 TSval=1205547826 TSecr=0 SACK_PERM"
"1377","25.082324540","2402:3a80:1bd5:d964:c9a3:a1a8:4554:7741","2404:6800:4002:823::200e","TCP","182","-37 dBm,-39 dBm,-37 dBm","144.444","","-37 dBm","QoS Data","58896  >  443 [SYN] Seq=0 Win=65535 Len=0 MSS=1298 WS=64 TSval=2960651183 TSecr=0 SACK_PERM"
"1378","25.082327883","192.168.33.211","142.250.193.46","TCP","162","-37 dBm,-39 dBm,-37 dBm","144.444","","-37 dBm","QoS Data","58895  >  443 [SYN] Seq=0 Win=65535 Len=0 MSS=1460 WS=64 TSval=1953985377 TSecr=0 SACK_PERM"
"1562","33.034386643","2402:3a80:1bd5:d964:c9a3:a1a8:4554:7741","2404:6800:4002:823::200e","TCP","182","-37 dBm,-39 dBm,-37 dBm","144.444","","-37 dBm","QoS Data","[TCP Retransmission] 58894  >  443 [SYN] Seq=0 Win=65535 Len=0 MSS=1298 WS=64 TSval=2941619743 TSecr=0 SACK_PERM"
"1582","33.093092427","2402:3a80:1bd5:d964:c9a3:a1a8:4554:7741","2404:6800:4002:823::200e","TCP","182","-38 dBm,-39 dBm,-38 dBm","144.444","","-38 dBm","QoS Data","[TCP Retransmission] 58896  >  443 [SYN] Seq=0 Win=65535 Len=0 MSS=1298 WS=64 TSval=2960659184 TSecr=0 SACK_PERM"
"1583","33.093100817","192.168.33.211","142.250.193.46","TCP","162","-38 dBm,-39 dBm,-38 dBm","144.444","","-38 dBm","QoS Data","[TCP Retransmission] 58895  >  443 [SYN] Seq=0 Win=65535 Len=0 MSS=1460 WS=64 TSval=1953993378 TSecr=0 SACK_PERM"
"1611","33.202410293","2402:3a80:1fff:3f::1108:871e","2402:3a80:1bd5:d964:c9a3:a1a8:4554:7741","TCP","170","-28 dBm,-38 dBm,-28 dBm","130","","-28 dBm","QoS Data","443  >  58876 [ACK] Seq=1 Ack=1 Win=92 Len=0 TSval=1083265157 TSecr=1031442618"
"1613","33.202447464","2402:3a80:1fff:3f::1108:871e","2402:3a80:1bd5:d964:c9a3:a1a8:4554:7741","TCP","170","-28 dBm,-37 dBm,-28 dBm","130","","-28 dBm","QoS Data","443  >  58876 [ACK] Seq=1 Ack=25 Win=92 Len=0 TSval=1083265157 TSecr=1031442619"
"1615","33.204763367","2402:3a80:1fff:3f::1108:871e","2402:3a80:1bd5:d964:c9a3:a1a8:4554:7741","TCP","170","-28 dBm,-37 dBm,-28 dBm","130","","-28 dBm","QoS Data","443  >  58876 [RST, ACK] Seq=1 Ack=25 Win=92 Len=0 TSval=1083265157 TSecr=1031442619"
"1619","33.205630541","2402:3a80:1bd5:d964:c9a3:a1a8:4554:7741","2402:3a80:1fff:3f::1108:871e","TCP","170","-37 dBm,-39 dBm,-37 dBm","144.444","","-37 dBm","QoS Data","58876  >  443 [FIN, ACK] Seq=25 Ack=1 Win=2048 Len=0 TSval=1031442819 TSecr=1083265157"
"2130","49.598070347","Apple_2c:98:37","2a:b8:02:f0:1e:54","802.11","84","-37 dBm,-39 dBm,-37 dBm","24","","-37 dBm","Null function (No data)","Null function (No data), SN=2888, FN=0, Flags=...P...TC"
"2155","49.678171148","Apple_2c:98:37","2a:b8:02:f0:1e:54","802.11","84","-37 dBm,-38 dBm,-37 dBm","24","","-37 dBm","Null function (No data)","Null function (No data), SN=2889, FN=0, Flags=.......TC"
"2159","49.678377001","192.168.33.211","54.173.11.126","TLSv1.2","227","-37 dBm,-38 dBm,-37 dBm","144.444","","-37 dBm","QoS Data","Application Data, Encrypted Alert"
"2161","49.682135081","fe80::28b8:2ff:fef0:1e54","fe80::18f1:7ed2:7bfc:12a6","ICMPv6","162","-28 dBm,-39 dBm,-28 dBm","130","","-28 dBm","QoS Data","Neighbor Solicitation for fe80::18f1:7ed2:7bfc:12a6 from 2a:b8:02:f0:1e:54"
"2166","49.684311046","fe80::18f1:7ed2:7bfc:12a6","fe80::28b8:2ff:fef0:1e54","ICMPv6","162","-37 dBm,-38 dBm,-37 dBm","144.444","","-37 dBm","QoS Data","Neighbor Advertisement fe80::18f1:7ed2:7bfc:12a6 (sol)"
"2276","53.694719708","Apple_2c:98:37","2a:b8:02:f0:1e:54","802.11","84","-38 dBm,-38 dBm,-38 dBm","24","","-38 dBm","Null function (No data)","Null function (No data), SN=2899, FN=0, Flags=.......TC"
"2280","53.695095689","192.168.33.211","17.253.18.198","TCP","150","-37 dBm,-38 dBm,-37 dBm","144.444","","-37 dBm","QoS Data","58851  >  80 [FIN, ACK] Seq=1 Ack=1 Win=2053 Len=0 TSval=1793228578 TSecr=3314272172"
"3332","85.851362807","Apple_2c:98:37","2a:b8:02:f0:1e:54","802.11","84","-39 dBm,-39 dBm,-39 dBm","24","","-39 dBm","Null function (No data)","Null function (No data), SN=2951, FN=0, Flags=.......TC"
"3416","86.058778347","Apple_2c:98:37","2a:b8:02:f0:1e:54","802.11","84","-38 dBm,-39 dBm,-38 dBm","24","","-38 dBm","Null function (No data)","Null function (No data), SN=2952, FN=0, Flags=...P...TC"
"3503","89.883221637","Apple_2c:98:37","2a:b8:02:f0:1e:54","802.11","84","-39 dBm,-41 dBm,-39 dBm","24","","-39 dBm","Null function (No data)","Null function (No data), SN=2962, FN=0, Flags=...P...TC"
"3998","102.301571121","Apple_2c:98:37","2a:b8:02:f0:1e:54","802.11","84","-37 dBm,-39 dBm,-37 dBm","24","","-37 dBm","Null function (No data)","Null function (No data), SN=2983, FN=0, Flags=.......TC"
"4003","102.301610891","192.168.33.211","54.192.142.4","TCP","138","-37 dBm,-39 dBm,-37 dBm","130","","-37 dBm","QoS Data","58889  >  443 [ACK] Seq=1 Ack=1 Win=2048 Len=0"
"4018","102.364041113","54.192.142.4","192.168.33.211","TCP","150","-28 dBm,-38 dBm,-28 dBm","130","","-28 dBm","QoS Data","[TCP ACKed unseen segment] 443  >  58889 [ACK] Seq=1 Ack=2 Win=144 Len=0 TSval=2166074486 TSecr=1013748399"
