"No.","Time","Source","Destination","Protocol","Length","Sender IP address","Info"
"110","0.919177","10.1.2.21","10.1.1.2","TCP","94","","49153  >  59 [SYN] Seq=0 Win=65535 Len=0 TSval=1000 TSecr=0 WS=4 SACK_PERM"
"118","0.922170","10.1.2.13","10.1.1.2","TCP","94","","49153  >  51 [SYN] Seq=0 Win=65535 Len=0 TSval=1000 TSecr=0 WS=4 SACK_PERM"
"127","0.923716","10.1.2.17","10.1.1.2","TCP","94","","49153  >  55 [SYN] Seq=0 Win=65535 Len=0 TSval=1000 TSecr=0 WS=4 SACK_PERM"
"132","0.924857","10.1.2.11","10.1.1.2","TCP","94","","49153  >  49 [SYN] Seq=0 Win=65535 Len=0 TSval=1000 TSecr=0 WS=4 SACK_PERM"
"136","0.925091","10.1.2.3","10.1.1.2","TCP","94","","49153  >  41 [SYN] Seq=0 Win=65535 Len=0 TSval=1000 TSecr=0 WS=4 SACK_PERM"
"151","0.927281","10.1.2.5","10.1.1.2","TCP","94","","49153  >  43 [SYN] Seq=0 Win=65535 Len=0 TSval=1000 TSecr=0 WS=4 SACK_PERM"
"156","0.928462","10.1.2.7","10.1.1.2","TCP","94","","49153  >  45 [SYN] Seq=0 Win=65535 Len=0 TSval=1000 TSecr=0 WS=4 SACK_PERM"
"161","0.929735","10.1.2.9","10.1.1.2","TCP","94","","49153  >  47 [SYN] Seq=0 Win=65535 Len=0 TSval=1000 TSecr=0 WS=4 SACK_PERM"
"166","0.930941","10.1.2.19","10.1.1.2","TCP","94","","49153  >  57 [SYN] Seq=0 Win=65535 Len=0 TSval=1000 TSecr=0 WS=4 SACK_PERM"
"171","0.932073","10.1.2.15","10.1.1.2","TCP","94","","49153  >  53 [SYN] Seq=0 Win=65535 Len=0 TSval=1000 TSecr=0 WS=4 SACK_PERM"
"219","1.037130","10.1.2.3","10.1.1.2","TCP","94","","10  >  49154 [SYN, ACK] Seq=0 Ack=1 Win=65535 Len=0 TSval=1119 TSecr=0 WS=4 SACK_PERM"
"223","1.037560","10.1.2.5","10.1.1.2","TCP","94","","12  >  49156 [SYN, ACK] Seq=0 Ack=1 Win=65535 Len=0 TSval=1119 TSecr=0 WS=4 SACK_PERM"
"227","1.039825","10.1.2.7","10.1.1.2","TCP","94","","14  >  49158 [SYN, ACK] Seq=0 Ack=1 Win=65535 Len=0 TSval=1119 TSecr=0 WS=4 SACK_PERM"
"233","1.041199","10.1.2.11","10.1.1.2","TCP","94","","18  >  49162 [SYN, ACK] Seq=0 Ack=1 Win=65535 Len=0 TSval=1123 TSecr=0 WS=4 SACK_PERM"
"240","1.041928","10.1.2.13","10.1.1.2","TCP","94","","20  >  49164 [SYN, ACK] Seq=0 Ack=1 Win=65535 Len=0 TSval=1123 TSecr=0 WS=4 SACK_PERM"
"244","1.043428","10.1.2.15","10.1.1.2","TCP","94","","22  >  49166 [SYN, ACK] Seq=0 Ack=1 Win=65535 Len=0 TSval=1123 TSecr=0 WS=4 SACK_PERM"
"246","1.044916","10.1.2.9","10.1.1.2","TCP","94","","16  >  49160 [SYN, ACK] Seq=0 Ack=1 Win=65535 Len=0 TSval=1122 TSecr=0 WS=4 SACK_PERM"
"250","1.045208","10.1.2.17","10.1.1.2","TCP","94","","24  >  49168 [SYN, ACK] Seq=0 Ack=1 Win=65535 Len=0 TSval=1127 TSecr=0 WS=4 SACK_PERM"
"254","1.045496","10.1.2.19","10.1.1.2","TCP","94","","26  >  49170 [SYN, ACK] Seq=0 Ack=1 Win=65535 Len=0 TSval=1127 TSecr=0 WS=4 SACK_PERM"
"269","1.058730","10.1.2.21","10.1.1.2","TCP","94","","28  >  49172 [SYN, ACK] Seq=0 Ack=1 Win=65535 Len=0 TSval=1127 TSecr=0 WS=4 SACK_PERM"
"288","1.119383","10.1.2.21","10.1.1.2","TCP","90","","49153  >  59 [ACK] Seq=1 Ack=1 Win=131072 Len=0 TSval=1201 TSecr=1101"
"292","1.122414","10.1.2.13","10.1.1.2","TCP","90","","49153  >  51 [ACK] Seq=1 Ack=1 Win=131072 Len=0 TSval=1204 TSecr=1104"
"296","1.123916","10.1.2.17","10.1.1.2","TCP","90","","49153  >  55 [ACK] Seq=1 Ack=1 Win=131072 Len=0 TSval=1205 TSecr=1105"
"300","1.125054","10.1.2.11","10.1.1.2","TCP","90","","49153  >  49 [ACK] Seq=1 Ack=1 Win=131072 Len=0 TSval=1207 TSecr=1107"
"305","1.126807","10.1.2.3","10.1.1.2","TCP","90","","49153  >  41 [ACK] Seq=1 Ack=1 Win=131072 Len=0 TSval=1208 TSecr=1107"
"309","1.127509","10.1.2.5","10.1.1.2","TCP","90","","49153  >  43 [ACK] Seq=1 Ack=1 Win=131072 Len=0 TSval=1209 TSecr=1109"
"313","1.128672","10.1.2.7","10.1.1.2","TCP","90","","49153  >  45 [ACK] Seq=1 Ack=1 Win=131072 Len=0 TSval=1210 TSecr=1110"
"317","1.129956","10.1.2.9","10.1.1.2","TCP","90","","49153  >  47 [ACK] Seq=1 Ack=1 Win=131072 Len=0 TSval=1211 TSecr=1111"
"321","1.131171","10.1.2.19","10.1.1.2","TCP","90","","49153  >  57 [ACK] Seq=1 Ack=1 Win=131072 Len=0 TSval=1213 TSecr=1113"
"325","1.132289","10.1.2.15","10.1.1.2","TCP","90","","49153  >  53 [ACK] Seq=1 Ack=1 Win=131072 Len=0 TSval=1214 TSecr=1114"
"631","1.439739","10.1.2.3","10.1.1.2","TCP","90","","[TCP ACKed unseen segment] 10  >  49154 [ACK] Seq=1 Ack=5361 Win=131072 Len=0 TSval=1521 TSecr=1219"
"663","1.445622","10.1.2.5","10.1.1.2","TCP","90","","[TCP ACKed unseen segment] 12  >  49156 [ACK] Seq=1 Ack=5361 Win=131072 Len=0 TSval=1527 TSecr=1219"
"665","1.450054","10.1.2.7","10.1.1.2","TCP","90","","[TCP ACKed unseen segment] 14  >  49158 [ACK] Seq=1 Ack=5361 Win=131072 Len=0 TSval=1532 TSecr=1222"
"670","1.450501","10.1.2.5","10.1.1.2","TCP","90","","[TCP ACKed unseen segment] 12  >  49156 [ACK] Seq=1 Ack=6433 Win=131072 Len=0 TSval=1532 TSecr=1432"
"698","1.452982","10.1.2.11","10.1.1.2","TCP","90","","[TCP ACKed unseen segment] 18  >  49162 [ACK] Seq=1 Ack=5361 Win=131072 Len=0 TSval=1535 TSecr=1223"
"703","1.456005","10.1.2.7","10.1.1.2","TCP","90","","[TCP ACKed unseen segment] 14  >  49158 [ACK] Seq=1 Ack=6433 Win=131072 Len=0 TSval=1538 TSecr=1437"
"731","1.459623","10.1.2.13","10.1.1.2","TCP","90","","[TCP ACKed unseen segment] 20  >  49164 [ACK] Seq=1 Ack=5361 Win=131072 Len=0 TSval=1541 TSecr=1224"
"822","1.471175","10.1.2.9","10.1.1.2","TCP","90","","[TCP ACKed unseen segment] 16  >  49160 [ACK] Seq=1 Ack=5361 Win=131072 Len=0 TSval=1553 TSecr=1227"
"824","1.475549","10.1.2.17","10.1.1.2","TCP","90","","[TCP ACKed unseen segment] 24  >  49168 [ACK] Seq=1 Ack=5361 Win=131072 Len=0 TSval=1557 TSecr=1227"
"826","1.478168","10.1.2.19","10.1.1.2","TCP","90","","[TCP ACKed unseen segment] 26  >  49170 [ACK] Seq=1 Ack=5361 Win=131072 Len=0 TSval=1560 TSecr=1227"
"831","1.479607","10.1.2.9","10.1.1.2","TCP","90","","[TCP ACKed unseen segment] 16  >  49160 [ACK] Seq=1 Ack=6433 Win=131072 Len=0 TSval=1561 TSecr=1461"
"918","1.485945","10.1.2.21","10.1.1.2","TCP","90","","[TCP ACKed unseen segment] 28  >  49172 [ACK] Seq=1 Ack=5361 Win=131072 Len=0 TSval=1568 TSecr=1240"
"923","1.488153","10.1.2.21","10.1.1.2","TCP","90","","[TCP ACKed unseen segment] 28  >  49172 [ACK] Seq=1 Ack=6433 Win=131072 Len=0 TSval=1570 TSecr=1469"
"957","1.640238","10.1.2.3","10.1.1.2","TCP","90","","10  >  49154 [ACK] Seq=1 Ack=16081 Win=131072 Len=0 TSval=1722 TSecr=1621"
"962","1.645430","10.1.2.3","10.1.1.2","TCP","90","","[TCP ACKed unseen segment] 10  >  49154 [ACK] Seq=1 Ack=17153 Win=131072 Len=0 TSval=1727 TSecr=1627"
"1002","1.648719","10.1.2.5","10.1.1.2","TCP","90","","[TCP ACKed unseen segment] 12  >  49156 [ACK] Seq=1 Ack=16081 Win=131072 Len=0 TSval=1730 TSecr=1627"
"1026","1.650641","10.1.2.7","10.1.1.2","TCP","90","","14  >  49158 [ACK] Seq=1 Ack=16081 Win=131072 Len=0 TSval=1732 TSecr=1632"
"1090","1.656194","10.1.2.11","10.1.1.2","TCP","90","","[TCP ACKed unseen segment] 18  >  49162 [ACK] Seq=1 Ack=16081 Win=131072 Len=0 TSval=1738 TSecr=1635"
"1154","1.661666","10.1.2.13","10.1.1.2","TCP","90","","[TCP ACKed unseen segment] 20  >  49164 [ACK] Seq=1 Ack=16081 Win=131072 Len=0 TSval=1743 TSecr=1641"
"2069","1.882895","10.1.2.11","10.1.1.2","TCP","90","","[TCP ACKed unseen segment] 18  >  49162 [ACK] Seq=1 Ack=38593 Win=131072 Len=0 TSval=1964 TSecr=1864"
"2183","1.898479","10.1.2.13","10.1.1.2","TCP","90","","[TCP ACKed unseen segment] 20  >  49164 [ACK] Seq=1 Ack=38593 Win=131072 Len=0 TSval=1980 TSecr=1880"
"2329","1.923381","10.1.2.9","10.1.1.2","TCP","90","","[TCP ACKed unseen segment] 16  >  49160 [ACK] Seq=1 Ack=36449 Win=131072 Len=0 TSval=2005 TSecr=1905"
"2956","2.030528","10.1.2.2","10.1.1.2","TCP","94","","9  >  49153 [SYN, ACK] Seq=0 Ack=1 Win=65535 Len=0 TSval=2108 TSecr=0 WS=4 SACK_PERM"
"2959","2.030895","10.1.2.18","10.1.1.2","TCP","94","","25  >  49169 [SYN, ACK] Seq=0 Ack=1 Win=65535 Len=0 TSval=2111 TSecr=0 WS=4 SACK_PERM"
"2966","2.033445","10.1.2.18","10.1.1.2","TCP","94","","[TCP Retransmission] 25  >  49169 [SYN, ACK] Seq=0 Ack=1 Win=65535 Len=0 TSval=2111 TSecr=0 WS=4 SACK_PERM"
"2981","2.038974","10.1.2.16","10.1.1.2","TCP","94","","23  >  49167 [SYN, ACK] Seq=0 Ack=1 Win=65535 Len=0 TSval=2110 TSecr=0 WS=4 SACK_PERM"
"2983","2.039558","10.1.2.16","10.1.1.2","TCP","94","","[TCP Retransmission] 23  >  49167 [SYN, ACK] Seq=0 Ack=1 Win=65535 Len=0 TSval=2110 TSecr=0 WS=4 SACK_PERM"
"3000","2.042870","10.1.2.18","10.1.1.2","TCP","94","","[TCP Retransmission] 25  >  49169 [SYN, ACK] Seq=0 Ack=1 Win=65535 Len=0 TSval=2111 TSecr=0 WS=4 SACK_PERM"
"3066","2.070911","10.1.2.3","10.1.1.2","TCP","90","","[TCP ACKed unseen segment] 10  >  49154 [ACK] Seq=1 Ack=85761 Win=131072 Len=0 TSval=2153 TSecr=2052"
"4159","2.155587","10.1.2.21","10.1.1.2","TCP","602","","49153  >  59 [ACK] Seq=1 Ack=1 Win=131072 Len=512 TSval=2221 TSecr=1101"
"4161","2.155962","10.1.2.15","10.1.1.2","DNS","602","","[Malformed Packet]"
"4163","2.159944","10.1.2.9","10.1.1.2","TCP","602","","49153  >  47 [ACK] Seq=1 Ack=1 Win=131072 Len=512 TSval=2232 TSecr=1111"
"4165","2.160143","10.1.2.19","10.1.1.2","TCP","602","","49153  >  57 [ACK] Seq=1 Ack=1 Win=131072 Len=512 TSval=2233 TSecr=1113"
"4167","2.160224","10.1.2.3","10.1.1.2","TCP","602","","49153  >  41 [ACK] Seq=1 Ack=1 Win=131072 Len=512 TSval=2229 TSecr=1107"
"4168","2.160585","10.1.2.17","10.1.1.2","TCP","602","","49153  >  55 [ACK] Seq=1 Ack=1 Win=131072 Len=512 TSval=2226 TSecr=1105"
"4170","2.161021","10.1.2.5","10.1.1.2","TCP","602","","49153  >  43 [ACK] Seq=1 Ack=1 Win=131072 Len=512 TSval=2230 TSecr=1109 [TCP segment of a reassembled PDU]"
"4172","2.161120","10.1.2.3","10.1.1.2","TCP","602","","[TCP Retransmission] 49153  >  41 [ACK] Seq=1 Ack=1 Win=131072 Len=512 TSval=2229 TSecr=1107"
"4174","2.161623","10.1.2.21","10.1.1.2","TCP","602","","49153  >  59 [ACK] Seq=513 Ack=1 Win=131072 Len=512 TSval=2242 TSecr=1101"
"4176","2.161983","10.1.2.7","10.1.1.2","TCP","602","","49153  >  45 [ACK] Seq=1 Ack=1 Win=131072 Len=512 TSval=2231 TSecr=1110"
"4203","2.173359","10.1.2.19","10.1.1.2","TCP","602","","49153  >  57 [ACK] Seq=513 Ack=1 Win=131072 Len=512 TSval=2254 TSecr=1113"
"4207","2.173728","10.1.2.9","10.1.1.2","TCP","602","","49153  >  47 [ACK] Seq=513 Ack=1 Win=131072 Len=512 TSval=2252 TSecr=1111"
"4209","2.173827","10.1.2.3","10.1.1.2","TCP","602","","49153  >  41 [ACK] Seq=513 Ack=1 Win=131072 Len=512 TSval=2249 TSecr=1107"
"4210","2.174156","10.1.2.3","10.1.1.2","TCP","602","","[TCP Retransmission] 49153  >  41 [ACK] Seq=513 Ack=1 Win=131072 Len=512 TSval=2249 TSecr=1107"
"4212","2.175021","10.1.2.15","10.1.1.2","DNS","602","","[Malformed Packet]"
"4255","2.176353","10.1.2.5","10.1.1.2","TCP","602","","49153  >  43 [ACK] Seq=513 Ack=1 Win=131072 Len=512 TSval=2250 TSecr=1109 [TCP segment of a reassembled PDU]"
"4257","2.176672","10.1.2.3","10.1.1.2","TCP","602","","[TCP Retransmission] 49153  >  41 [ACK] Seq=513 Ack=1 Win=131072 Len=512 TSval=2249 TSecr=1107"
"4258","2.177389","10.1.2.7","10.1.1.2","TCP","602","","49153  >  45 [ACK] Seq=513 Ack=1 Win=131072 Len=512 TSval=2251 TSecr=1110"
"4261","2.178086","10.1.2.3","10.1.1.2","TCP","602","","[TCP Retransmission] 49153  >  41 [ACK] Seq=513 Ack=1 Win=131072 Len=512 TSval=2249 TSecr=1107"
"4263","2.179147","10.1.2.17","10.1.1.2","TCP","602","","49153  >  55 [ACK] Seq=513 Ack=1 Win=131072 Len=512 TSval=2246 TSecr=1105"
"4268","2.180858","10.1.2.21","10.1.1.2","TCP","602","","49153  >  59 [ACK] Seq=1025 Ack=1 Win=131072 Len=512 TSval=2262 TSecr=1101"
"4278","2.191489","10.1.2.13","10.1.1.2","TCP","602","","[TCP Previous segment not captured] 49153  >  51 [ACK] Seq=1025 Ack=1 Win=131072 Len=512 TSval=2265 TSecr=1104"
"4280","2.191570","10.1.2.3","10.1.1.2","TCP","602","","49153  >  41 [ACK] Seq=1025 Ack=1 Win=131072 Len=512 TSval=2270 TSecr=1107"
"4282","2.191933","10.1.2.7","10.1.1.2","TCP","602","","49153  >  45 [ACK] Seq=1025 Ack=1 Win=131072 Len=512 TSval=2272 TSecr=1110"
"4296","2.195961","10.1.2.11","10.1.1.2","TACACS+","602","","[TCP Previous segment not captured] Q: Unknown (0x00)"
"4298","2.196767","10.1.2.5","10.1.1.2","TCP","602","","49153  >  43 [ACK] Seq=1025 Ack=1 Win=131072 Len=512 TSval=2270 TSecr=1109 [TCP segment of a reassembled PDU]"
"4300","2.197151","10.1.2.15","10.1.1.2","DNS","602","","[Malformed Packet]"
"4302","2.197435","10.1.2.19","10.1.1.2","TCP","602","","49153  >  57 [ACK] Seq=1025 Ack=1 Win=131072 Len=512 TSval=2274 TSecr=1113"
"4304","2.197760","10.1.2.17","10.1.1.2","TCP","602","","49153  >  55 [ACK] Seq=1025 Ack=1 Win=131072 Len=512 TSval=2267 TSecr=1105"
"4306","2.198015","10.1.2.9","10.1.1.2","TCP","602","","49153  >  47 [ACK] Seq=1025 Ack=1 Win=131072 Len=512 TSval=2273 TSecr=1111"
"4322","2.201338","10.1.2.21","10.1.1.2","TCP","602","","49153  >  59 [ACK] Seq=1537 Ack=1 Win=131072 Len=512 TSval=2283 TSecr=1101"
"4390","2.206920","10.1.2.17","10.1.1.2","TCP","602","","49153  >  55 [ACK] Seq=1537 Ack=1 Win=131072 Len=512 TSval=2287 TSecr=1105"
"4392","2.207199","10.1.2.13","10.1.1.2","TCP","602","","49153  >  51 [ACK] Seq=1537 Ack=1 Win=131072 Len=512 TSval=2286 TSecr=1104"
"4548","2.216000","10.1.2.15","10.1.1.2","DNS","602","","[Malformed Packet]"
"4550","2.216256","10.1.2.5","10.1.1.2","TCP","602","","49153  >  43 [ACK] Seq=1537 Ack=1 Win=131072 Len=512 TSval=2291 TSecr=1109 [TCP segment of a reassembled PDU]"
"4552","2.216395","10.1.2.9","10.1.1.2","TCP","90","","[TCP ACKed unseen segment] 16  >  49160 [ACK] Seq=1 Ack=144721 Win=131072 Len=0 TSval=2294 TSecr=2111"
"4554","2.216603","10.1.2.19","10.1.1.2","TCP","602","","49153  >  57 [ACK] Seq=1537 Ack=1 Win=131072 Len=512 TSval=2295 TSecr=1113"
"4556","2.216684","10.1.2.3","10.1.1.2","TCP","602","","49153  >  41 [ACK] Seq=1537 Ack=1 Win=131072 Len=512 TSval=2290 TSecr=1107"
"4558","2.217121","10.1.2.7","10.1.1.2","TCP","602","","49153  >  45 [ACK] Seq=1537 Ack=1 Win=131072 Len=512 TSval=2292 TSecr=1110"
"4560","2.217338","10.1.2.11","10.1.1.2","TACACS+","602","","Q: Unknown (0x00)"
"4701","2.226359","10.1.2.17","10.1.1.2","TCP","602","","49153  >  55 [ACK] Seq=2049 Ack=1 Win=131072 Len=512 TSval=2308 TSecr=1105"
"4801","2.232252","10.1.2.5","10.1.1.2","TCP","602","","49153  >  43 [ACK] Seq=2049 Ack=1 Win=131072 Len=512 TSval=2311 TSecr=1109 [TCP segment of a reassembled PDU]"
"4803","2.232489","10.1.2.9","10.1.1.2","TCP","602","","[TCP Previous segment not captured] 49153  >  47 [ACK] Seq=2049 Ack=1 Win=131072 Len=512 TSval=2314 TSecr=1111"
"4830","2.234700","10.1.2.13","10.1.1.2","TCP","602","","49153  >  51 [ACK] Seq=2049 Ack=1 Win=131072 Len=512 TSval=2306 TSecr=1104"
"4832","2.234919","10.1.2.7","10.1.1.2","TCP","602","","49153  >  45 [ACK] Seq=2049 Ack=1 Win=131072 Len=512 TSval=2313 TSecr=1110"
"4834","2.235118","10.1.2.11","10.1.1.2","TACACS+","602","","Q: Unknown (0x00)"
"4836","2.235199","10.1.2.3","10.1.1.2","TCP","602","","49153  >  41 [ACK] Seq=2049 Ack=1 Win=131072 Len=512 TSval=2311 TSecr=1107"
"5048","2.248385","10.1.2.15","10.1.1.2","DNS","602","","[Malformed Packet]"
"5050","2.248605","10.1.2.13","10.1.1.2","TCP","602","","49153  >  51 [ACK] Seq=2561 Ack=1 Win=131072 Len=512 TSval=2327 TSecr=1104"
"5052","2.248883","10.1.2.21","10.1.1.2","TCP","602","","[TCP Previous segment not captured] 49153  >  59 [ACK] Seq=2561 Ack=1 Win=131072 Len=512 TSval=2324 TSecr=1101"
"5119","2.249987","10.1.2.11","10.1.1.2","TACACS+","602","","Q: Unknown (0x00)"
"5121","2.250068","10.1.2.3","10.1.1.2","TCP","602","","49153  >  41 [ACK] Seq=2561 Ack=1 Win=131072 Len=512 TSval=2331 TSecr=1107"
"5122","2.250384","10.1.2.5","10.1.1.2","TCP","602","","49153  >  43 [ACK] Seq=2561 Ack=1 Win=131072 Len=512 TSval=2332 TSecr=1109 [TCP segment of a reassembled PDU]"
"5126","2.250839","10.1.2.17","10.1.1.2","TCP","602","","49153  >  55 [ACK] Seq=2561 Ack=1 Win=131072 Len=512 TSval=2328 TSecr=1105"
"5154","2.254544","10.1.2.3","10.1.1.2","TCP","602","","[TCP Retransmission] 49153  >  41 [ACK] Seq=2561 Ack=1 Win=131072 Len=512 TSval=2331 TSecr=1107"
"5155","2.254899","10.1.2.9","10.1.1.2","TCP","602","","49153  >  47 [ACK] Seq=2561 Ack=1 Win=131072 Len=512 TSval=2334 TSecr=1111"
"5157","2.255127","10.1.2.7","10.1.1.2","TCP","602","","49153  >  45 [ACK] Seq=2561 Ack=1 Win=131072 Len=512 TSval=2333 TSecr=1110"
"5186","2.261271","10.1.2.19","10.1.1.2","TCP","602","","[TCP Previous segment not captured] 49153  >  57 [ACK] Seq=2561 Ack=1 Win=131072 Len=512 TSval=2336 TSecr=1113"
"5286","2.268807","10.1.2.17","10.1.1.2","TCP","602","","49153  >  55 [ACK] Seq=3073 Ack=1 Win=131072 Len=512 TSval=2349 TSecr=1105"
"5288","2.269067","10.1.2.21","10.1.1.2","TCP","602","","49153  >  59 [ACK] Seq=3073 Ack=1 Win=131072 Len=512 TSval=2344 TSecr=1101"
"5290","2.269274","10.1.2.13","10.1.1.2","TCP","602","","49153  >  51 [ACK] Seq=3073 Ack=1 Win=131072 Len=512 TSval=2347 TSecr=1104"
"5357","2.274600","10.1.2.9","10.1.1.2","TCP","602","","49153  >  47 [ACK] Seq=3073 Ack=1 Win=131072 Len=512 TSval=2355 TSecr=1111"
"5359","2.274837","10.1.2.7","10.1.1.2","TCP","602","","49153  >  45 [ACK] Seq=3073 Ack=1 Win=131072 Len=512 TSval=2354 TSecr=1110"
"5364","2.275790","10.1.2.15","10.1.1.2","DNS","602","","[TCP Previous segment not captured] [Malformed Packet]"
"5366","2.281450","10.1.2.19","10.1.1.2","TCP","602","","49153  >  57 [ACK] Seq=3073 Ack=1 Win=131072 Len=512 TSval=2356 TSecr=1113"
"5370","2.281790","10.1.2.11","10.1.1.2","TACACS+","602","","Q: Unknown (0x00)"
"5372","2.281997","10.1.2.5","10.1.1.2","TCP","602","","49153  >  43 [ACK] Seq=3073 Ack=1 Win=131072 Len=512 TSval=2352 TSecr=1109 [TCP segment of a reassembled PDU]"
"5409","2.289009","10.1.2.13","10.1.1.2","TCP","602","","49153  >  51 [ACK] Seq=3585 Ack=1 Win=131072 Len=512 TSval=2368 TSecr=1104"
"5411","2.289225","10.1.2.17","10.1.1.2","TCP","602","","49153  >  55 [ACK] Seq=3585 Ack=1 Win=131072 Len=512 TSval=2369 TSecr=1105"
"5413","2.289512","10.1.2.21","10.1.1.2","TCP","602","","49153  >  59 [ACK] Seq=3585 Ack=1 Win=131072 Len=512 TSval=2365 TSecr=1101"
"5415","2.289711","10.1.2.11","10.1.1.2","TACACS+","602","","Q: Unknown (0x00)"
"5482","2.295717","10.1.2.5","10.1.1.2","TCP","602","","49153  >  43 [ACK] Seq=3585 Ack=1 Win=131072 Len=512 TSval=2373 TSecr=1109 [TCP segment of a reassembled PDU]"
"5517","2.297451","10.1.2.3","10.1.1.2","TCP","602","","[TCP Previous segment not captured] 49153  >  41 [ACK] Seq=3585 Ack=1 Win=131072 Len=512 TSval=2372 TSecr=1107"
"5584","2.303095","10.1.2.15","10.1.1.2","DNS","602","","[Malformed Packet]"
"5586","2.303336","10.1.2.7","10.1.1.2","TCP","602","","49153  >  45 [ACK] Seq=3585 Ack=1 Win=131072 Len=512 TSval=2374 TSecr=1110"
"5651","2.307215","10.1.2.13","10.1.1.2","TCP","602","","49153  >  51 [ACK] Seq=4097 Ack=1 Win=131072 Len=512 TSval=2388 TSecr=1104"
"5678","2.309438","10.1.2.9","10.1.1.2","TCP","602","","49153  >  47 [ACK] Seq=3585 Ack=1 Win=131072 Len=512 TSval=2375 TSecr=1111"
"5680","2.309646","10.1.2.11","10.1.1.2","TACACS+","602","","Q: Unknown (0x00)"
"5682","2.309854","10.1.2.17","10.1.1.2","TCP","602","","49153  >  55 [ACK] Seq=4097 Ack=1 Win=131072 Len=512 TSval=2390 TSecr=1105"
"5684","2.310712","10.1.2.19","10.1.1.2","TCP","602","","49153  >  57 [ACK] Seq=3585 Ack=1 Win=131072 Len=512 TSval=2377 TSecr=1113"
"5701","2.311600","10.1.2.3","10.1.1.2","TCP","602","","49153  >  41 [ACK] Seq=4097 Ack=1 Win=131072 Len=512 TSval=2393 TSecr=1107"
"5718","2.312584","10.1.2.5","10.1.1.2","TCP","602","","49153  >  43 [ACK] Seq=4097 Ack=1 Win=131072 Len=512 TSval=2393 TSecr=1109 [TCP segment of a reassembled PDU]"
"5723","2.315471","10.1.2.19","10.1.1.2","TCP","602","","49153  >  57 [ACK] Seq=4097 Ack=1 Win=131072 Len=512 TSval=2397 TSecr=1113"
"5724","2.315684","10.1.2.7","10.1.1.2","TCP","602","","49153  >  45 [ACK] Seq=4097 Ack=1 Win=131072 Len=512 TSval=2395 TSecr=1110"
"5727","2.316150","10.1.2.19","10.1.1.2","TCP","602","","[TCP Retransmission] 49153  >  57 [ACK] Seq=4097 Ack=1 Win=131072 Len=512 TSval=2397 TSecr=1113"
"5729","2.316477","10.1.2.9","10.1.1.2","TCP","602","","49153  >  47 [ACK] Seq=4097 Ack=1 Win=131072 Len=512 TSval=2396 TSecr=1111"
"5733","2.318209","10.1.2.15","10.1.1.2","DNS","602","","[Malformed Packet]"
"5751","2.324720","10.1.2.21","10.1.1.2","TCP","602","","[TCP Previous segment not captured] 49153  >  59 [ACK] Seq=4609 Ack=1 Win=131072 Len=512 TSval=2406 TSecr=1101"
"5763","2.335373","10.1.2.11","10.1.1.2","TACACS+","602","","Q: Unknown (0x00)"
"5765","2.335454","10.1.2.3","10.1.1.2","TCP","602","","49153  >  41 [ACK] Seq=4609 Ack=1 Win=131072 Len=512 TSval=2413 TSecr=1107"
"5766","2.335756","10.1.2.17","10.1.1.2","TCP","602","","49153  >  55 [ACK] Seq=4609 Ack=1 Win=131072 Len=512 TSval=2410 TSecr=1105"
"5768","2.336174","10.1.2.13","10.1.1.2","TCP","602","","49153  >  51 [ACK] Seq=4609 Ack=1 Win=131072 Len=512 TSval=2409 TSecr=1104"
"5770","2.336373","10.1.2.8","10.1.1.2","TCP","90","","[TCP ACKed unseen segment] 15  >  49159 [ACK] Seq=1 Ack=537 Win=32768 Len=0 TSval=2400 TSecr=2216"
"5772","2.336594","10.1.2.19","10.1.1.2","TCP","602","","49153  >  57 [ACK] Seq=4609 Ack=1 Win=131072 Len=512 TSval=2418 TSecr=1113"
"5774","2.336828","10.1.2.5","10.1.1.2","WHOIS","602","","Query: "
"5776","2.337276","10.1.2.3","10.1.1.2","TCP","602","","[TCP Retransmission] 49153  >  41 [ACK] Seq=4609 Ack=1 Win=131072 Len=512 TSval=2413 TSecr=1107"
"5778","2.337619","10.1.2.8","10.1.1.2","TCP","90","","[TCP Dup ACK 5770#1] 15  >  49159 [ACK] Seq=1 Ack=537 Win=32768 Len=0 TSval=2400 TSecr=2216"
"5780","2.337998","10.1.2.15","10.1.1.2","DNS","602","","[Malformed Packet]"
"5783","2.338476","10.1.2.8","10.1.1.2","TCP","90","","[TCP ACKed unseen segment] 15  >  49159 [ACK] Seq=1 Ack=2681 Win=32768 Len=0 TSval=2402 TSecr=2216"
"5811","2.345878","10.1.2.7","10.1.1.2","TCP","602","","49153  >  45 [ACK] Seq=4609 Ack=1 Win=131072 Len=512 TSval=2415 TSecr=1110"
"5882","2.365673","10.1.2.16","10.1.1.2","TCP","90","","[TCP ACKed unseen segment] 23  >  49167 [ACK] Seq=1 Ack=4825 Win=131072 Len=0 TSval=2447 TSecr=2221"
"6140","2.401762","10.1.2.12","10.1.1.2","TCP","90","","[TCP ACKed unseen segment] 19  >  49163 [ACK] Seq=1 Ack=5361 Win=32768 Len=0 TSval=2483 TSecr=2104"
"6142","2.402032","10.1.2.12","10.1.1.2","TCP","90","","[TCP Dup ACK 6140#1] 19  >  49163 [ACK] Seq=1 Ack=5361 Win=32768 Len=0 TSval=2483 TSecr=2104"
"8668","2.577042","10.1.2.16","10.1.1.2","TCP","90","","[TCP ACKed unseen segment] 23  >  49167 [ACK] Seq=1 Ack=5361 Win=131072 Len=0 TSval=2647 TSecr=2221"
"8902","2.592607","10.1.2.18","10.1.1.2","TCP","90","","[TCP ACKed unseen segment] 25  >  49169 [ACK] Seq=1 Ack=5361 Win=131072 Len=0 TSval=2670 TSecr=2225"
"9471","2.629657","10.1.2.9","10.1.1.2","TCP","106","","[TCP ACKed unseen segment] 16  >  49160 [ACK] Seq=1 Ack=223513 Win=131072 Len=0 TSval=2674 TSecr=2395 SLE=229409 SRE=258145 SLE=224049 SRE=228873"
"10635","2.722033","10.1.2.21","10.1.1.2","TCP","602","","[TCP Previous segment not captured] 49153  >  59 [ACK] Seq=14337 Ack=1 Win=131072 Len=512 TSval=2795 TSecr=2648"
"11331","2.766965","10.1.2.5","10.1.1.2","TCP","602","","[TCP Previous segment not captured] 49153  >  43 [ACK] Seq=15361 Ack=1 Win=131072 Len=512 TSval=2844 TSecr=2716 [TCP segment of a reassembled PDU]"
"11849","2.798696","10.1.2.13","10.1.1.2","TCP","602","","[TCP Previous segment not captured] 49153  >  51 [ACK] Seq=16385 Ack=1 Win=131072 Len=512 TSval=2880 TSecr=2730"
"11983","2.810428","10.1.2.5","10.1.1.2","TCP","602","","[TCP Previous segment not captured] 49153  >  43 [ACK] Seq=16385 Ack=1 Win=131072 Len=512 TSval=2885 TSecr=2716 [TCP segment of a reassembled PDU]"
"12197","2.820977","10.1.2.17","10.1.1.2","TCP","602","","[TCP Previous segment not captured] 49153  >  55 [ACK] Seq=16897 Ack=1 Win=131072 Len=512 TSval=2902 TSecr=2680"
"12344","2.833992","10.1.2.13","10.1.1.2","TCP","602","","49153  >  51 [ACK] Seq=16897 Ack=1 Win=131072 Len=512 TSval=2900 TSecr=2730"
"12354","2.835376","10.1.2.5","10.1.1.2","WHOIS","602","","Query: "
"12449","2.839805","10.1.2.4","10.1.1.2","TCP","90","","[TCP ACKed unseen segment] 11  >  49155 [ACK] Seq=1 Ack=8041 Win=32768 Len=0 TSval=2920 TSecr=2532"
"12451","2.840029","10.1.2.13","10.1.1.2","TCP","602","","49153  >  51 [ACK] Seq=17409 Ack=1 Win=131072 Len=512 TSval=2921 TSecr=2730"
"12589","2.851126","10.1.2.19","10.1.1.2","TCP","602","","[TCP Previous segment not captured] 49153  >  57 [ACK] Seq=17409 Ack=1 Win=131072 Len=512 TSval=2930 TSecr=2744"
"12717","2.858175","10.1.2.11","10.1.1.2","TACACS+","602","","[TCP Previous segment not captured] Q: Unknown (0x00)"
"12849","2.865329","10.1.2.11","10.1.1.2","TACACS+","602","","Q: Unknown (0x00)"
"12851","2.865537","10.1.2.13","10.1.1.2","TCP","602","","49153  >  51 [ACK] Seq=17921 Ack=1 Win=131072 Len=512 TSval=2941 TSecr=2730"
"12919","2.878047","10.1.2.19","10.1.1.2","TCP","602","","49153  >  57 [ACK] Seq=17921 Ack=1 Win=131072 Len=512 TSval=2950 TSecr=2744"
"12990","2.880622","10.1.2.5","10.1.1.2","TCP","602","","[TCP Previous segment not captured] 49153  >  43 [ACK] Seq=17921 Ack=1 Win=131072 Len=512 TSval=2946 TSecr=2765 [TCP segment of a reassembled PDU]"
"12992","2.880832","10.1.2.9","10.1.1.2","TCP","114","","[TCP Dup ACK 9471#1] 16  >  49160 [ACK] Seq=1 Ack=223513 Win=131072 Len=0 TSval=2953 TSecr=2395 SLE=330777 SRE=351745 SLE=286209 SRE=330241 SLE=229409 SRE=285721"
"13446","2.915269","10.1.2.7","10.1.1.2","TCP","106","","[TCP ACKed unseen segment] 14  >  49158 [ACK] Seq=1 Ack=334337 Win=131072 Len=0 TSval=2984 TSecr=2646 SLE=377345 SRE=384001 SLE=334873 SRE=376857"
"13770","2.942604","10.1.2.13","10.1.1.2","TCP","602","","[TCP Previous segment not captured] 49153  >  51 [ACK] Seq=19969 Ack=1 Win=131072 Len=512 TSval=3023 TSecr=2865"
"13988","2.952278","10.1.2.17","10.1.1.2","TCP","114","","[TCP ACKed unseen segment] 24  >  49168 [ACK] Seq=1 Ack=220833 Win=131072 Len=0 TSval=3009 TSecr=2431 SLE=345089 SRE=348209 SLE=275457 SRE=344601 SLE=221369 SRE=274969"
"14118","2.965587","10.1.2.13","10.1.1.2","TCP","602","","49153  >  51 [ACK] Seq=20481 Ack=1 Win=131072 Len=512 TSval=3044 TSecr=2865"
"14406","2.987518","10.1.2.13","10.1.1.2","TCP","602","","49153  >  51 [ACK] Seq=20993 Ack=1 Win=131072 Len=512 TSval=3064 TSecr=2865"
"14446","2.991202","10.1.2.21","10.1.1.2","TCP","602","","[TCP Previous segment not captured] 49153  >  59 [ACK] Seq=20993 Ack=1 Win=131072 Len=512 TSval=3061 TSecr=2904"
"14618","3.003046","10.1.2.21","10.1.1.2","TCP","602","","49153  >  59 [ACK] Seq=21505 Ack=1 Win=131072 Len=512 TSval=3082 TSecr=2904"
"15386","3.065936","10.1.2.13","10.1.1.2","TCP","602","","[TCP Previous segment not captured] 49153  >  51 [ACK] Seq=23041 Ack=1 Win=131072 Len=512 TSval=3146 TSecr=2980"
"15510","3.085474","10.1.2.13","10.1.1.2","TCP","602","","49153  >  51 [ACK] Seq=23553 Ack=1 Win=131072 Len=512 TSval=3167 TSecr=2980"
"15606","3.097099","10.1.2.15","10.1.1.2","DNS","602","","[TCP Previous segment not captured] [Malformed Packet]"
"15678","3.099655","10.1.2.11","10.1.1.2","TACACS+","602","","[TCP Previous segment not captured] Q: Unknown (0x00)"
"15725","3.105441","10.1.2.13","10.1.1.2","TCP","602","","49153  >  51 [ACK] Seq=24065 Ack=1 Win=131072 Len=512 TSval=3187 TSecr=2980"
"15801","3.109827","10.1.2.11","10.1.1.2","TACACS+","602","","Q: Unknown (0x00)"
"15873","3.113719","10.1.2.5","10.1.1.2","TCP","602","","[TCP Previous segment not captured] 49153  >  43 [ACK] Seq=24065 Ack=1 Win=131072 Len=512 TSval=3192 TSecr=3046 [TCP segment of a reassembled PDU]"
"15956","3.121889","10.1.2.15","10.1.1.2","DNS","602","","[Malformed Packet]"
"16667","3.167771","10.1.2.9","10.1.1.2","TCP","90","","[TCP ACKed unseen segment] 16  >  49160 [ACK] Seq=1 Ack=353793 Win=131072 Len=0 TSval=3249 TSecr=3061"
"16671","3.168338","10.1.2.19","10.1.1.2","TCP","90","","[TCP ACKed unseen segment] 26  >  49170 [ACK] Seq=1 Ack=353793 Win=131072 Len=0 TSval=3250 TSecr=3090"
"18054","3.311606","10.1.2.13","10.1.1.2","TCP","90","","[TCP ACKed unseen segment] 20  >  49164 [ACK] Seq=1 Ack=340017 Win=131072 Len=0 TSval=3381 TSecr=3073"
"18186","3.319558","10.1.2.15","10.1.1.2","TCP","90","","22  >  49166 [ACK] Seq=1 Ack=348209 Win=131072 Len=0 TSval=3401 TSecr=3183"
"18265","3.324292","10.1.2.5","10.1.1.2","TCP","90","","[TCP ACKed unseen segment] 12  >  49156 [ACK] Seq=1 Ack=430137 Win=131072 Len=0 TSval=3405 TSecr=3133"
"19529","3.423483","10.1.2.11","10.1.1.2","TCP","90","","[TCP ACKed unseen segment] 18  >  49162 [ACK] Seq=1 Ack=433721 Win=131072 Len=0 TSval=3502 TSecr=3133"
"20669","3.528253","10.1.2.21","10.1.1.2","TCP","90","","[TCP ACKed unseen segment] 28  >  49172 [ACK] Seq=1 Ack=348745 Win=131072 Len=0 TSval=3602 TSecr=3279"
"21142","3.591731","10.1.2.19","10.1.1.2","TCP","90","","[TCP ACKed unseen segment] 26  >  49170 [ACK] Seq=1 Ack=446521 Win=131072 Len=0 TSval=3673 TSecr=3336"
"21397","3.629139","10.1.2.18","10.1.1.2","TCP","98","","[TCP ACKed unseen segment] 25  >  49169 [ACK] Seq=1 Ack=64857 Win=131072 Len=0 TSval=3681 TSecr=3454 SLE=65393 SRE=73969"
"21850","3.696907","10.1.2.5","10.1.1.2","TCP","90","","[TCP ACKed unseen segment] 12  >  49156 [ACK] Seq=1 Ack=529833 Win=131072 Len=0 TSval=3778 TSecr=3506"
"21909","3.702592","10.1.2.11","10.1.1.2","TCP","90","","[TCP ACKed unseen segment] 18  >  49162 [ACK] Seq=1 Ack=532881 Win=131072 Len=0 TSval=3783 TSecr=3403"
"24798","3.919986","10.1.2.4","10.1.1.2","TCP","94","","49153  >  42 [SYN] Seq=0 Win=65535 Len=0 TSval=4000 TSecr=0 WS=4 SACK_PERM"
"24801","3.925708","10.1.2.8","10.1.1.2","TCP","94","","49153  >  46 [SYN] Seq=0 Win=65535 Len=0 TSval=4000 TSecr=0 WS=4 SACK_PERM"
"24806","3.926203","10.1.2.18","10.1.1.2","TCP","94","","49153  >  56 [SYN] Seq=0 Win=65535 Len=0 TSval=4000 TSecr=0 WS=4 SACK_PERM"
"24809","3.926929","10.1.2.16","10.1.1.2","TCP","94","","49153  >  54 [SYN] Seq=0 Win=65535 Len=0 TSval=4000 TSecr=0 WS=4 SACK_PERM"
"24810","3.927113","10.1.2.18","10.1.1.2","TCP","94","","[TCP Retransmission] 49153  >  56 [SYN] Seq=0 Win=65535 Len=0 TSval=4000 TSecr=0 WS=4 SACK_PERM"
"24817","3.928498","10.1.2.16","10.1.1.2","TCP","94","","[TCP Retransmission] 49153  >  54 [SYN] Seq=0 Win=65535 Len=0 TSval=4000 TSecr=0 WS=4 SACK_PERM"
"24819","3.928812","10.1.2.16","10.1.1.2","TCP","94","","[TCP Retransmission] 49153  >  54 [SYN] Seq=0 Win=65535 Len=0 TSval=4000 TSecr=0 WS=4 SACK_PERM"
"24823","3.929654","10.1.2.18","10.1.1.2","TCP","94","","[TCP Retransmission] 49153  >  56 [SYN] Seq=0 Win=65535 Len=0 TSval=4000 TSecr=0 WS=4 SACK_PERM"
"24853","3.934095","10.1.2.16","10.1.1.2","TCP","94","","[TCP Retransmission] 49153  >  54 [SYN] Seq=0 Win=65535 Len=0 TSval=4000 TSecr=0 WS=4 SACK_PERM"
"26416","4.123753","10.1.2.21","10.1.1.2","TCP","602","","[TCP Previous segment not captured] 49153  >  59 [ACK] Seq=24577 Ack=1 Win=131072 Len=512 TSval=4204 TSecr=3626"
"26462","4.127964","10.1.2.17","10.1.1.2","TCP","602","","[TCP Previous segment not captured] 49153  >  55 [ACK] Seq=24577 Ack=1 Win=131072 Len=512 TSval=4209 TSecr=3503"
"26464","4.128228","10.1.2.13","10.1.1.2","TCP","602","","49153  >  51 [ACK] Seq=24577 Ack=1 Win=131072 Len=512 TSval=4207 TSecr=3487"
"26468","4.128738","10.1.2.11","10.1.1.2","TACACS+","602","","Q: Unknown (0x00)"
"26475","4.130362","10.1.2.3","10.1.1.2","TCP","602","","[TCP Previous segment not captured] 49153  >  41 [ACK] Seq=24577 Ack=1 Win=131072 Len=512 TSval=4212 TSecr=3334"
"26477","4.131040","10.1.2.5","10.1.1.2","TCP","602","","49153  >  43 [ACK] Seq=24577 Ack=1 Win=131072 Len=512 TSval=4213 TSecr=3495 [TCP segment of a reassembled PDU]"
"26479","4.132186","10.1.2.7","10.1.1.2","TCP","602","","[TCP Previous segment not captured] 49153  >  45 [ACK] Seq=24577 Ack=1 Win=131072 Len=512 TSval=4214 TSecr=3518"
"26481","4.133465","10.1.2.9","10.1.1.2","TCP","602","","[TCP Previous segment not captured] 49153  >  47 [ACK] Seq=24577 Ack=1 Win=131072 Len=512 TSval=4215 TSecr=3316"
"26483","4.134680","10.1.2.19","10.1.1.2","TCP","602","","[TCP Previous segment not captured] 49153  >  57 [ACK] Seq=24577 Ack=1 Win=131072 Len=512 TSval=4216 TSecr=3335"
"26486","4.136191","10.1.2.15","10.1.1.2","DNS","602","","[Malformed Packet]"
"26555","4.148904","10.1.2.21","10.1.1.2","TCP","602","","49153  >  59 [ACK] Seq=25089 Ack=1 Win=131072 Len=512 TSval=4225 TSecr=3626"
"26557","4.149112","10.1.2.17","10.1.1.2","TCP","602","","49153  >  55 [ACK] Seq=25089 Ack=1 Win=131072 Len=512 TSval=4229 TSecr=3503"
"26559","4.149328","10.1.2.11","10.1.1.2","TACACS+","602","","Q: Unknown (0x00)"
"26561","4.149583","10.1.2.13","10.1.1.2","TCP","602","","49153  >  51 [ACK] Seq=25089 Ack=1 Win=131072 Len=512 TSval=4228 TSecr=3487"
"26573","4.155505","10.1.2.7","10.1.1.2","TCP","602","","49153  >  45 [ACK] Seq=25089 Ack=1 Win=131072 Len=512 TSval=4234 TSecr=3518"
"26586","4.156758","10.1.2.5","10.1.1.2","TCP","602","","49153  >  43 [ACK] Seq=25089 Ack=1 Win=131072 Len=512 TSval=4233 TSecr=3495 [TCP segment of a reassembled PDU]"
"26591","4.157161","10.1.2.9","10.1.1.2","TCP","602","","49153  >  47 [ACK] Seq=25089 Ack=1 Win=131072 Len=512 TSval=4235 TSecr=3316"
"26593","4.157481","10.1.2.15","10.1.1.2","DNS","602","","[Malformed Packet]"
"26597","4.157772","10.1.2.3","10.1.1.2","TCP","602","","49153  >  41 [ACK] Seq=25089 Ack=1 Win=131072 Len=512 TSval=4232 TSecr=3334"
"26610","4.159199","10.1.2.19","10.1.1.2","TCP","602","","49153  >  57 [ACK] Seq=25089 Ack=1 Win=131072 Len=512 TSval=4237 TSecr=3335"
"26656","4.164778","10.1.2.21","10.1.1.2","TCP","602","","49153  >  59 [ACK] Seq=25601 Ack=1 Win=131072 Len=512 TSval=4245 TSecr=3626"
"26680","4.167693","10.1.2.13","10.1.1.2","TCP","602","","49153  >  51 [ACK] Seq=25601 Ack=1 Win=131072 Len=512 TSval=4248 TSecr=3487"
"26684","4.168384","10.1.2.17","10.1.1.2","TCP","602","","49153  >  55 [ACK] Seq=25601 Ack=1 Win=131072 Len=512 TSval=4250 TSecr=3503"
"26699","4.170036","10.1.2.11","10.1.1.2","TACACS+","602","","Q: Unknown (0x00)"
"26846","4.177636","10.1.2.3","10.1.1.2","TCP","602","","49153  >  41 [ACK] Seq=25601 Ack=1 Win=131072 Len=512 TSval=4253 TSecr=3334"
"26847","4.178059","10.1.2.7","10.1.1.2","TCP","602","","49153  >  45 [ACK] Seq=25601 Ack=1 Win=131072 Len=512 TSval=4255 TSecr=3518"
"26849","4.178314","10.1.2.5","10.1.1.2","TCP","602","","49153  >  43 [ACK] Seq=25601 Ack=1 Win=131072 Len=512 TSval=4254 TSecr=3495 [TCP segment of a reassembled PDU]"
"26851","4.178513","10.1.2.9","10.1.1.2","TCP","602","","49153  >  47 [ACK] Seq=25601 Ack=1 Win=131072 Len=512 TSval=4256 TSecr=3316"
"26860","4.180903","10.1.2.19","10.1.1.2","TCP","602","","49153  >  57 [ACK] Seq=25601 Ack=1 Win=131072 Len=512 TSval=4257 TSecr=3335"
"26862","4.181020","10.1.2.3","10.1.1.2","TCP","602","","[TCP Retransmission] 49153  >  41 [ACK] Seq=25601 Ack=1 Win=131072 Len=512 TSval=4253 TSecr=3334"
"26864","4.181859","10.1.2.15","10.1.1.2","DNS","602","","[Malformed Packet]"
"26872","4.187610","10.1.2.21","10.1.1.2","TCP","602","","49153  >  59 [ACK] Seq=26113 Ack=1 Win=131072 Len=512 TSval=4266 TSecr=3626"
"26937","4.193357","10.1.2.5","10.1.1.2","TCP","602","","49153  >  43 [ACK] Seq=26113 Ack=1 Win=131072 Len=512 TSval=4274 TSecr=3495 [TCP segment of a reassembled PDU]"
"26941","4.193985","10.1.2.7","10.1.1.2","TCP","602","","49153  >  45 [ACK] Seq=26113 Ack=1 Win=131072 Len=512 TSval=4275 TSecr=3518"
"26943","4.194066","10.1.2.3","10.1.1.2","TCP","602","","49153  >  41 [ACK] Seq=26113 Ack=1 Win=131072 Len=512 TSval=4273 TSecr=3334"
"26944","4.195251","10.1.2.17","10.1.1.2","TCP","602","","49153  >  55 [ACK] Seq=26113 Ack=1 Win=131072 Len=512 TSval=4270 TSecr=3503"
"26946","4.202024","10.1.2.9","10.1.1.2","TCP","602","","49153  >  47 [ACK] Seq=26113 Ack=1 Win=131072 Len=512 TSval=4276 TSecr=3316"
"26952","4.202993","10.1.2.15","10.1.1.2","DNS","602","","[Malformed Packet]"
"26954","4.203275","10.1.2.13","10.1.1.2","TCP","602","","49153  >  51 [ACK] Seq=26113 Ack=1 Win=131072 Len=512 TSval=4269 TSecr=3487"
"26956","4.203518","10.1.2.11","10.1.1.2","TACACS+","602","","Q: Unknown (0x00)"
"26958","4.203608","10.1.2.3","10.1.1.2","TCP","602","","[TCP Retransmission] 49153  >  41 [ACK] Seq=26113 Ack=1 Win=131072 Len=512 TSval=4273 TSecr=3334"
"26960","4.203959","10.1.2.17","10.1.1.2","TCP","602","","[TCP Retransmission] 49153  >  55 [ACK] Seq=26113 Ack=1 Win=131072 Len=512 TSval=4270 TSecr=3503"
"26963","4.204341","10.1.2.9","10.1.1.2","TCP","602","","[TCP Retransmission] 49153  >  47 [ACK] Seq=26113 Ack=1 Win=131072 Len=512 TSval=4276 TSecr=3316"
"26991","4.209491","10.1.2.21","10.1.1.2","TCP","602","","49153  >  59 [ACK] Seq=26625 Ack=1 Win=131072 Len=512 TSval=4286 TSecr=3626"
"27022","4.212565","10.1.2.17","10.1.1.2","TCP","602","","49153  >  55 [ACK] Seq=26625 Ack=1 Win=131072 Len=512 TSval=4291 TSecr=3503"
"27024","4.212772","10.1.2.11","10.1.1.2","TACACS+","602","","Q: Unknown (0x00)"
"27026","4.212991","10.1.2.13","10.1.1.2","TCP","602","","49153  >  51 [ACK] Seq=26625 Ack=1 Win=131072 Len=512 TSval=4289 TSecr=3487"
"27028","4.218378","10.1.2.5","10.1.1.2","TCP","602","","49153  >  43 [ACK] Seq=26625 Ack=1 Win=131072 Len=512 TSval=4294 TSecr=3495 [TCP segment of a reassembled PDU]"
"27093","4.220130","10.1.2.15","10.1.1.2","DNS","602","","[Malformed Packet]"
"27095","4.220220","10.1.2.3","10.1.1.2","TCP","602","","49153  >  41 [ACK] Seq=26625 Ack=1 Win=131072 Len=512 TSval=4294 TSecr=3334"
"27097","4.220581","10.1.2.9","10.1.1.2","TCP","602","","49153  >  47 [ACK] Seq=26625 Ack=1 Win=131072 Len=512 TSval=4297 TSecr=3316"
"27099","4.220818","10.1.2.7","10.1.1.2","TCP","602","","49153  >  45 [ACK] Seq=26625 Ack=1 Win=131072 Len=512 TSval=4296 TSecr=3518"
"27136","4.227365","10.1.2.21","10.1.1.2","TCP","602","","49153  >  59 [ACK] Seq=27137 Ack=1 Win=131072 Len=512 TSval=4307 TSecr=3626"
"27155","4.231601","10.1.2.11","10.1.1.2","TACACS+","602","","Q: Unknown (0x00)"
"27157","4.231872","10.1.2.17","10.1.1.2","TCP","602","","49153  >  55 [ACK] Seq=27137 Ack=1 Win=131072 Len=512 TSval=4311 TSecr=3503"
"27159","4.232142","10.1.2.6","10.1.1.2","TCP","94","","49153  >  44 [SYN] Seq=0 Win=65535 Len=0 TSval=4000 TSecr=0 WS=4 SACK_PERM"
"27161","4.232297","10.1.2.14","10.1.1.2","TCP","94","","49153  >  52 [SYN] Seq=0 Win=65535 Len=0 TSval=4000 TSecr=0 WS=4 SACK_PERM"
"27162","4.232530","10.1.2.13","10.1.1.2","TCP","602","","49153  >  51 [ACK] Seq=27137 Ack=1 Win=131072 Len=512 TSval=4310 TSecr=3487"
"27164","4.232656","10.1.2.3","10.1.1.2","TCP","602","","49153  >  41 [ACK] Seq=27137 Ack=1 Win=131072 Len=512 TSval=4314 TSecr=3334"
"27167","4.233436","10.1.2.5","10.1.1.2","WHOIS","602","","Query: "
"27412","4.246788","10.1.2.19","10.1.1.2","TCP","602","","[TCP Previous segment not captured] 49153  >  57 [ACK] Seq=27137 Ack=1 Win=131072 Len=512 TSval=4319 TSecr=3335"
"27414","4.247057","10.1.2.21","10.1.1.2","TCP","602","","49153  >  59 [ACK] Seq=27649 Ack=1 Win=131072 Len=512 TSval=4327 TSecr=3626"
"27416","4.247317","10.1.2.9","10.1.1.2","TCP","602","","49153  >  47 [ACK] Seq=27137 Ack=1 Win=131072 Len=512 TSval=4317 TSecr=3316"
"27481","4.253059","10.1.2.13","10.1.1.2","TCP","602","","49153  >  51 [ACK] Seq=27649 Ack=1 Win=131072 Len=512 TSval=4330 TSecr=3487"
"27483","4.253140","10.1.2.3","10.1.1.2","TCP","602","","49153  >  41 [ACK] Seq=27649 Ack=1 Win=131072 Len=512 TSval=4335 TSecr=3334"
"27546","4.258798","10.1.2.17","10.1.1.2","TCP","602","","49153  >  55 [ACK] Seq=27649 Ack=1 Win=131072 Len=512 TSval=4332 TSecr=3503"
"27675","4.266927","10.1.2.11","10.1.1.2","TACACS+","602","","Q: Unknown (0x00)"
"27677","4.267134","10.1.2.19","10.1.1.2","TCP","602","","49153  >  57 [ACK] Seq=27649 Ack=1 Win=131072 Len=512 TSval=4339 TSecr=3335"
"27682","4.271106","10.1.2.13","10.1.1.2","TCP","602","","49153  >  51 [ACK] Seq=28161 Ack=1 Win=131072 Len=512 TSval=4351 TSecr=3487"
"27684","4.271305","10.1.2.17","10.1.1.2","TCP","602","","49153  >  55 [ACK] Seq=28161 Ack=1 Win=131072 Len=512 TSval=4352 TSecr=3503"
"27686","4.271632","10.1.2.7","10.1.1.2","TCP","602","","[TCP Previous segment not captured] 49153  >  45 [ACK] Seq=27649 Ack=1 Win=131072 Len=512 TSval=4337 TSecr=3518"
"27688","4.271875","10.1.2.19","10.1.1.2","TCP","602","","[TCP Retransmission] 49153  >  57 [ACK] Seq=27649 Ack=1 Win=131072 Len=512 TSval=4339 TSecr=3335"
"27697","4.275005","10.1.2.11","10.1.1.2","TACACS+","602","","Q: Unknown (0x00)"
